title,company,location,date,url,department,workplace_type,description
עבד/ת סוציאל/ית,מחוז דן פתח תקווה,רמת גן,2025-09-11,https://jobs.clalitapps.co.il/clalit/index.html?ci=0&positionId=44268,עבודה סוציאלית,,"דרוש/ה עובד/ת סוציאלי/ת מרכז/ת תחום התפתחות הילד בכפיפות למנהלת השרות לעבודה סוציאלית אחראית ישירה על צוות עו""ס במערך התפתחות הילד במחוז דן-פ""ת תיאור התפקיד: הנחיה ותיפעול צוות העו""ס בתחום התפתחות הילד בנושאי מדיניות ונהלי עבודה יוזמה , תכנון ופיתוח תוכניות ופרויקטים לקידום השירות הסוציאלי במערך התפתחות הילד. ביצוע רענון של חוקים ונהלים רלוונטים לתחום מהווה כתובת מקצועית להתייעצות בתחום התפתחות הילד עבור כלל השירות הסוציאלי אחריות על ביצוע בקרת רשומה מקצועית בתיקי המטופלים אחריות על קליטה והתאקלמות העו""סים במכונים להתפתחות הילד וביצוע הערכה תקופתית על תפקודם אחריות על קיום ישיבות צוות מקצועיות של העו""ס אחריות לווידא כי הצוות עומד ביעדי התפוקות כפי שהוגדרו על ידי השירות לעבודה סוציאלית בקרה מקצועית על איכות הטיפול ואיכות השירות הניתן ע""י העו""ס במכונים להתפתחות הילד אחריות על תהליכי ההכשרה וההדרכה של צוות העובדים הסוציאליים במכונים השתלבות בטיפולים פרטניים וקבוצתיים במכון להתפתחות הילד דרישות התפקיד: תואר שני בעבודה סוציאלית קלינית בוגר/ת ביה""ס לפסיכותרפיה - יתרון הכשרה בהדרכה נסיון בהדרכת עובדים נסיון של שנתיים ומעלה בניהול צוות נסיון מוכח במסגרת מכון להתפתחות הילד של שנתיים לפחות *תינתן עדיפות למועמדים/ות עם מוגבלויות"
פקיד/ה איזורי/ת במטה בנימין,מחוז ירושלים,מטה בנימין,2025-09-09,https://jobs.clalitapps.co.il/clalit/index.html?ci=0&positionId=48049,מנהל ומטה,,"דרוש/ה פקיד/ה איזורי/ת למרפאות במטה בנימין - בישובים: עפרה, בית אל, עלי, אדם/תל ציון ועוד - מעבר בין המרפאות השונות על פי הצורך היקף המשרה חלקי: 50% (20 ש""ש) תיאור התפקיד: מתן שירות פרונטלי וטלפוני ללקוחות המרפאה בנושאים אדמיניסטרטיביים קביעת תורים לרפואה ראשונית ויועצת והכוונת הלקוחות לשירותים הרפואיים המתאימים מתן מידע על זכויות המגיעות ללקוחות בהתאם לסל השירותים טיפול בנושאי גבייה והחזרים כספיים ללקוחות המרפאה מתן שירות אדמיניסטרטיבי לגורמים במרפאה: רופאים, אחיות, רוקחים, ובעלי מקצוע נוספים מועמדים/ות מתאימים/ות יעברו תהליך מיון הכולל ראיונות, מבחני מחשב ומרכז הערכה דרישות התפקיד: תעודת בגרות מלאה או מחבני חוץ (סאלד) - חובה רכב פרטי - חובה ניסיון בתפקידי שירות ומכירה - יתרון תודעת שירות גבוהה יחסי אנוש טובים, שיתוף פעולה בצוות יכולת עבודה בסביבה ממוחשבת ובתנאי לחץ ועומס *תינתן עדיפות למועמדים/ות עם מוגבלויות"
סמלנ/ית רפואי/ת,מרכז רפואי מאיר,ישראל,2025-09-03,https://jobs.clalitapps.co.il/clalit/index.html?ci=0&positionId=47798,מנהל ומטה,,"למרכז הרפואי מאיר דרוש/ה סמלנ/ית רפואי/ת ב 75% משרה שעות העבודה 08:00-14:00 בימים א-ה, קיימת גמישות תיאור התפקיד: אחריות לסימול המידע הרפואי בהתאם להנחיות ולכללים של שיטת הסימול הבין לאומית הנהוגה ועל פי נוהל עבודה של משרד הבריאות בדיקת שלמות גיליון שחרור המטופל סיווג וסימול הנתונים בהתאם לקידוד המאושר בעיבוד הנהוג לפי ההוראות אישור קידוד שבוצע ע""י הרופא או שינוי הקוד במידה ואינו נכון בתיאום עם הרופא המסכם בהתאם לנהלי בית החולים העברת נתונים על פי הסימול למאגר המידע הממוחשב של בית החולים השתתפות בהוצאת נתונים מתוך המאגר הממוחשב לצרכי עיבודים סטטיסטיים רפואיים ומנהליים בתאום עם הממונה ובהנחיתו ביצוע מטלות נוספות בתחום המקצועי לפי הוראות הממונה דרישות התפקיד: השכלה תיכונית מלאה (תעודת בגרות) - חובה השכלה אקדמית בתחום פארא רפואי - יתרון תעודה מזכירות רפואית - יתרון ידיעה טובה של השפה העברית אנגלית ברמה גבוהה , כולל קריאת מונחים מקצועיים רלוונטיים אמינות, דייקנות והקפדה על פרטים יחסי אנוש טובים *תינתן עדיפות למועמדים/ות עם מוגבלויות"
עובד/ת מעבדה,מרכז רפואי קפלן,רחובות,2025-09-03,https://jobs.clalitapps.co.il/clalit/index.html?ci=0&positionId=48018,מעבדות רפואיות,,למרכז הרפואי קפלן דרוש/ה עובד/ת מעבדה ל דיאגנוסטיקה רפואית לתפקיד המשלב עבודה עם המחלקה לפתולוגיה והמחלקה להמטולוגיה תיאור התפקיד: ביצוע בדיקות אבחנתיות במכשור NGS אפיון מחלות המטולוגיות באמצעות מכשיר FACS דרישות התפקיד: ניסיון בעבודת מעבדה מולקולרית - חובה תואר ראשון בתחום הביולוגיה - חובה תואר שני/שלישי בתחומי ביולוגיה/ביוטכנולוגיה/רפואה -יתרון תעודת הכרה במעמד עובד/ת מעבדה רפואית מטעם משרד הבריאות - יתרון ניסיון בביצוע אנליזות לתוצאות פאנלים ב- NGS - יתרון *תינתן עדיפות למועמדים/ות עם מוגבלויות
פקיד/ת קבלה ומיון,מרכז רפואי מאיר,מרכז רפואי מאיר,2025-08-26,https://jobs.clalitapps.co.il/clalit/index.html?ci=0&positionId=47152,מנהל ומטה,,"תיאור התפקיד: קבלה ושחרור מטופלים דחופים הפונים למיון טיפול בנושאים כספיים, גבייה והחזרים תיעוד ודיווח על הפעולות שבוצעו במערכות ממוחשבות דרישות התפקיד: תעודת 12 שנות לימוד/ תעודת בגרות מלאה יתרון לניסיון קודם בקבלת קהל או שירות בתחום הבריאות שליטה במחשב ובתוכנות Office שליטה מלאה בשפה העברית. יתרון לידיעה של שפה נוספות יכולת עבודה בסביבה לחוצה וריבוי משימות יחסי אנוש טובים, תודעת שירות גבוהה עבודה במשמרות 24/7, כולל סופי שבוע וחגים *תינתן עדיפות למועמדים/ות עם מוגבלויות"
קלינאי/ת תקשורת - בתחום השמיעה,מחוז דרום,"נתיבות, אשקלון, באר שבע",2025-08-25,https://jobs.clalitapps.co.il/clalit/index.html?ci=0&positionId=48005,קלינאות תקשורת,,"כללית מרחיבה את שירותיה ומזמינה אותך להצטרף לעבודה מעניינת ומאתגרת אנו מחפשים קלינאי/ת תקשורת ל: מכון שמיעה בנתיבות שירות התאמת מכשירי שמיעה - באר שבע ואשקלון הזדמנות להיות חלק מצוות איכותי, מקצועי, משפיע ומוביל קבלת הדרכה, השתתפות בימי עיון, השתלמויות אפשרות לשילוב תחומים, מסלול פיתוח אישי ותנאי שכר טובים ניסיון קודם, מהווה יתרון דרישות התפקיד : תואר ראשון בקלינאות תקשורת תעודת קלינאי/ת תקשורת מטעם משרד הבריאות עברית ברמת שפת אם שליטה באנגלית כדי קריאת ספרות מקצועית כושר הבעה בכתב ובעל פה יכולת עבודה בסביבה ממוחשבת יחסי אנוש טובים ויכולת עבודה בצוות יוזמה ופרו-אקטיביות ללמידה ולעשייה מקצועית * תינתן עדיפות למועמדים/ות עם מוגבלויות"
קלינאי/ת תקשורת - בתחום התפתחות הילד במחוז דרום,מחוז דרום,"שדרות, קרית גת, דימונה, ערד, אשקלון, באר שבע",2025-08-25,https://jobs.clalitapps.co.il/clalit/index.html?ci=0&positionId=46966,קלינאות תקשורת,,"כללית מרחיבה את שירותיה ומזמינה אותך להצטרף לעבודה משמעותית, מעניינת ומאתגרת בצוות מקצועי גדול ואיכותי דרושים/ות קלינאי/ות תקשורת לעבודה בתחום התפתחות הילד העבודה במחוז דרום: בשדרות, קרית גת, דימונה, ערד, אשקלון ובאר שבע. אפשרות לעבודה בצוות רב מקצועי, ובשילוב תחומים ויחידות. כוללת הדרכה, ימי עיון והשתלמויות. השתתפות בפרויקטים. אפשרויות קידום וגמישות תעסוקתית. יציבות וביטחון תעסוקתי, תנאים סוציאליים מהטובים במשק. דרישות התפקיד : תואר ראשון בקלינאות תקשורת רישיון עיסוק במקצוע - תעודת הכרה במעמד של משרד הבריאות עברית ברמת שפת אם שליטה באנגלית כדי קריאת ספרות מקצועית כושר הבעה בכתב ובעל פה יכולת עבודה בסביבה ממוחשבת יחסי אנוש טובים ויכולת עבודה בצוות * תינתן עדיפות למועמדים/ות עם מוגבלויות"
קלינאי/ת תקשורת,מחוז דן פתח תקווה,הוד השרון,2025-08-25,https://jobs.clalitapps.co.il/clalit/index.html?ci=0&positionId=46479,קלינאות תקשורת,,"דרוש/ה קלינאי/ת תקשורת ליחידת שיקום יום רב תחומית בהוד השרון תיאור התפקיד: ביצוע אבחון והערכה למבוגרים בתחומי השמיעה, השפה, הדיבור והבליעה. בתחום השמיעה: ביצוע בדיקות שמיעה לבדיקת סף השמיעה ובדיקות נוירופיזיולוגיות בתחום השפה והדיבור: הערכת הפרעות שפה נרכשות, הפרעות בקצב הדיבור, בעיות קול ובליעה. קביעת תוכנית טיפולית, וטיפול בהתאם לממצאי ההערכה לקיחת חלק פעיל בעבודת צוות מקצועי ורב מקצועי השתתפות בימי עיון והשתלמויות, התעדכנות בחידושים מקצועיים אפשרות להשתתפות בפרויקטים ובמחקרים דרישות התפקיד: תואר ראשון בקלינאות תקשורת רשיון עיסוק במקצוע - תעודת הכרה במעמד של משרד הבריאות שליטה בשפה העברית ברמת שפת אם שליטה באנגלית כדי קריאת ספרות מקצועית ידיעת שפה נוספת - יתרון כושר הבעה בכתב ובעל פה יכולת עבודה בסביבה ממוחשבת, שליטה בתוכנות Office יחסי אנוש טובים ויכולת עבודה בצוות יכולת הסתגלות לסביבות עבודה משתנות סקרנות ומוטיבציה ללמידה ולהתפתחות מקצועית *תינתן עדיפות למועמדים/ות עם מוגבלויות"
רופא/ת ילדים PEDIATRICIAN,מחוז שרון שומרון,נתניה /טירה/טייבה /צור יצחק,2025-08-21,https://jobs.clalitapps.co.il/clalit/index.html?ci=0&positionId=46958,רפואה,,"דרוש/ה רופא/ת ילדים מומחה ברפואת ילדים לכללית באיזור נתניה/טייבה/טירה/צור יצחק/כפר יונה בואו לארגון הבריאות הגדול במדינה ותזכו ל: אופק ניהולי פיתוח אישי ומקצועי תנאים סוציאליים מצויניים מה נדרש? ביצוע אבחונים, גיבוש תוכניות טיפול וטיפול במטופלים במרפאה במסגרת רפואת המשפחה עידוד מעורבות פעילה של הורי המטופל בטיפול ובמעקב אחר הילד השתתפות בוועדות, ישיבות ודיונים בנושאים מקצועיים שונים במרפאה ובמחוז העברת מידע רפואי, בכתב או בעל פה, על פי הצורך ובהתאם לדרישות ולנהלים קשרי עבודה עם גורמים שונים בקהילה ועם גורמי חוץ כגון: אקדמיה, בתי חולים ועוד ביצוע פעילות אקדמית של הדרכה ומחקר במסגרת הקהילה ומוסדות אקדמים על פי הצורך והמצאי השתלבות במערך הרפואה המחוזי, על פי המקובל ובהתאם להסכמים ולצרכים התעדכנות מקצועית שוטפת באמצעות ספרות מקצועית, מקורות מידע מקוונים, כנסים, השתלמויות ועוד ביצוע מטלות נוספות בתחום המקצועי לפי הוראות הממונה דרישות התפקיד: תואר MD ברפואה רישיון ישראלי לעסוק ברפואה תעודה מוכרת של מומחיות ברפואת ילדים תקשורת בין אישית טובה עם מטופלים ובני משפחותיהם שיתוף פעולה בצוות שירותיות, סבלנות ואמפתיה לזולת *תינתן עדיפות למועמדים/ות עם מוגבלויות"
רופא/ה מתמחה לרפואת משפחה,מחוז ירושלים,"בית שמש, ירושלים, עין גדי",2025-08-18,https://jobs.clalitapps.co.il/clalit/index.html?ci=0&positionId=47712,רפואה,,"תיאור התפקיד : מסלול התמחות בן 4 שנים. הכולל את השלבים הבאים: 15 חודשים במחלקה לרפואת המשפחה - מרפאת שלב א' בליווי מדריך 9 חודשים במחלקה פנימית חודשיים במחלקה לרפואה דחופה 5 חודשים ברפואת ילדים : חודשיים במחלקת ילדים, חודשיים במחלקה לרפואה דחופה ילדים, חודש במרפאת ילדים בבי""ח או מרפאת ילדים בקהילה או אשפוז יום ילדים חודשיים במרפאה פסיכיאטרית אמבולטורית בקהילה או בבית החולים חודשיים רוטציות לבחירה ממגוון מקצועות חודש במחלקה לרפואת המשפחה 12 חודשים במחלקה לרפואת המשפחה - מרפאה שלב ב' קורס אוניברסיטאי ברפואת המשפחה דרישות התפקיד : השכלה אקדמית - תואר MD רישיון ממשלתי בתוקף ורישוי לעסוק במקצוע הרפואה במדינת ישראל *ניתן להגיש מועמדות במהלך הסטאז' ולפני קבלת הרישיון"
פקיד/ה במרפאה,מחוז ירושלים,"דרום ירושלים (קריית היובל, קטמון-צומת פת, בית וגן, הר חומה)",2025-08-12,https://jobs.clalitapps.co.il/clalit/index.html?ci=0&positionId=47962,מנהל ומטה,,"תיאור התפקיד: מתן שירות פרונטלי וטלפוני ללקוחות המרפאה בנושאים אדמיניסטרטיביים קביעת תורים לרפואה ראשונית ויועצת, והכוונת הלקוחות לשירותים הרפואיים המתאימים מתן מידע על זכויות המגיעות ללקוחות בהתאם לסל השירותים טיפול בנושאי גבייה והחזרים כספיים ללקוחות המרפאה מתן שירות אדמיניסטרטיבי לגורמים במרפאה: רופאים, אחיות, רוקחים, ובעלי מקצוע נוספים היקף משרה חלקי (20-30 ש""ש, כלומר 50-75% משרה) מועמדים מתאימים יעברו תהליך מיון הכולל ראיונות, מבחני מחשב ומרכז הערכה דרישות התפקיד: תעודת בגרות מלאה (או מבחני חוץ או תאווג'יהי) - חובה ניסיון בתפקידי שירות ומכירה - יתרון תודעת שירות גבוהה יחסי אנוש טובים, שיתוף פעולה בצוות יכולת עבודה בסביבה ממוחשבת ובתנאי לחץ ועומס *תינתן עדיפות למועמדים/ות עם מוגבלויות"
עובד/ת סוציאלי/ת,מחוז דן פתח תקווה,"מחוז דן-פ""ת",2025-08-12,https://jobs.clalitapps.co.il/clalit/index.html?ci=0&positionId=47960,עבודה סוציאלית,,"למחוז דן-פ""ת דרוש/ה רפרנט/ית לתחום האוטיזם לחצי משרה תיאור התפקיד: הובלה של תחום האוטיזם ברמה מחוזית הערכות פסיכוסוציאליות ניתוב לגורמים טיפולים מיצוי זכויות ומתן מידע על מסגרות משלימות ליווי וטיפול המשפחות תוך התייחסות הולמת לקשיים המתעוררים לאורך הדרך בקרה על ספקים ומכוני הסדר המטפלים בילדים עם אוטיזם פיתוח קשרי עבודה עם גורמים קהילתיים הדרכות לצוותים הרב מקצועיים, השתתפות ועריכת ישיבות של צוות בכיר בתחום האוטיזם ברמה מחוזית וארצית קידום ימי עיון והשתלמויות בתחום האוטיזם והובלת והכנת בקרות משרד הבריאות לתחום זה. דרישות התפקיד: תואר שני בעבודה סוציאלית ניסיון בתחום האוטיזם חובה ניסיון של שנתיים במכון להתפתחות הילד *תינתן עדיפות למועמדים/ות עם מוגבלויות"
עובד/ת סוציאלי/ת,מחוז מרכז,רמלה,2025-08-06,https://jobs.clalitapps.co.il/clalit/index.html?ci=0&positionId=47948,עבודה סוציאלית,,"דרוש/ה עו""ס פסיכותרפיסט/ית למרפאת הפרעות אכילה ברמלה המרפאה כוללת צוות רב מקצועי העבודה מאפשרת התפתחות מקצועית וכוללת הדרכה פרטנית וקבוצתית והעשרה מקצועית תיאורטית ויישומית הקליטה לתפקיד כוללת הכשרה בת 12 מפגשים און ליין תיאור התפקיד: ביצוע הערכה פסיכוסוציאלית קלינית לצורך בניית תוכנית טיפול פסיכותרפיה פרטנית בהתאם לצרכי המטופל ומצבו עבודה מערכתית בהתאם לצרכים השתתפות בישיבות צוות ודיונים קליניים במרפאה במרפאות ילדים ונוער העבודה הטיפולית כוללת עבודה עם ההורים ומערכות חייו של המטופל דרישות התפקיד: רישום בפנקס עו""ס תואר שני בעבודה סוציאלית (עדיפות למסלול טיפולי) ניסיון של לפחות שנתיים בטיפול פסיכותרפויטי במבוגרים/ילדים. לא כולל הכשרה מעשית במסגרת הלימודים לתואר וותק של שנתיים לפחות במרפאה או במחלקה לבריאות הנפש (עדיפות( לא כולל הכשרה מעשית במסגרת הלימודים לתואר בוגרי/ות בי""ס לפסיכותרפיה (עדיפות) לימודי תעודה והסמכה בטיפול משפחתי (יתרון) היקף המשרה - 50% תנאי השכר בהתאם להסכם הקיבוצי במשק *תינתן עדיפות למועמדים/ות עם מוגבלויות"
סייע/ת בריפוי שיניים,מרכז רפואי קפלן,רחובות,2025-07-31,https://jobs.clalitapps.co.il/clalit/index.html?ci=0&positionId=47918,אחר,,"למרכז הרפואי קפלן דרוש/ה סייע/ת בריפוי שיניים לעבודה במשרה חלקית (50% משרה) תיאור התפקיד: סיוע לרופא/ת השיניים בטיפול הדנטלי במסגרת מרפאה/יחידה לפה ולסת בבית החולים טיפול בציוד הדנטלי הנייח, בדיקת אחזקתו התקינה ומעקב אחר ביצוע תיקונים בו ריכוז הזמנות לרכישה של ציוד וחומרים עפ""י הנהלים הקיימים הכנת חומרים לטיפול ולחלק אותם עפ""י צרכי העבודה טיפול בפינוי פסולת רפואית עפ""י הנהלים ביצוע תפקידים נוספים עפ""י הנחיות הממונים דרישות התפקיד: דיפלומה ממוסד מוכר כסייע/ת שיניים (לבוגר/ת חו""ל השכלת שוות ערך ללימודים בארץ) עמידה בהצלחה בבחינות הממשלתיות לסייע/ת לרופא/ת שיניים ידיעת השפה העברית על בורייה ידיעת שפה לועזית כדי קריאת מונחים מקצועיים-יתרון כושר ארגון ותכנון *תינתן עדיפות למועמדים/ות עם מוגבלויות"
מזכיר/ה למכון הדימות,מרכז רפואי מאיר,מרכז רפואי מאיר- כפר סבא,2025-07-31,https://jobs.clalitapps.co.il/clalit/index.html?ci=0&positionId=47916,מנהל ומטה,,"למרכז רפואי מאיר דרוש/ה מזכיר/ה למכון הדימות למשרה חלקית או מלאה, במשמרות תיאור התפקיד: קבלת חולים המופנים ממחלקות בית החולים כולל רפואה דחופה (מיונים), מרפאות ומכונים טיפול בפניות והזמנות לבדיקות מגורמים פנימיים או חיצוניים קבלת הזמנות ממוחשבות, זיהוי הבדיקה הנדרשת, פנייה לצוותי רפואה מענה טלפוני לפניות של נבדקים, רופאים וצוותים רפואיים קביעת תורים לבדיקות אמבולטוריות רישום ותיעוד נתוני נבדקים ובדיקות במערכות המחשוב וטיפול במסמכים הנלווים קשרי עבודה טובים 50% משרה 2-3 משמרות בשבוע (8 שעות משמרת) העבודה במשמרות שכוללות לילה וסופ""ש לפחות פעם בחודש *המשרה יכולה להתאים גם לסטודנטים/ות ניתן לעבוד במשרה מלאה או חלקית דרישות התפקיד : תעודת בגרות - חובה תעודת מזכירות רפואית - יתרון ידיעת השפה העברית על בוריה יתרון לידיעת שפות נוספות יחסי עבודה ואנוש תקינים, שירותיות, אחריות ויכולת ניהול זמן עצמאות, יכולת ניהול זמן, יסודיות ושמירה על דיסקרטיות * תינתן עדיפות למועמדים/ות עם מוגבלויות"
עובד/ת מינהל,מחוז דן פתח תקווה,בני ברק,2025-07-31,https://jobs.clalitapps.co.il/clalit/index.html?ci=0&positionId=46622,מנהל ומטה,,"דרוש/ה עובד/ת מנהל למרפאה עצמאית בבני ברק לחצי משרה שלוש פעמים בשבוע אחר הצהריים וימי שישי קבוע תיאור התפקיד: מתן שירות פרונטלי וטלפוני ללקוחות המרפאה קביעת תורים לרפואה ראשונית ויועצת והכוונת לקוחות לשירותים הרפואיים המתאימים מתן מידע על זכויות המגיעות ללקוחות טיפול בנושאי גבייה והחזרים כספיים ללקוחות טיפול בקליטת לקוחות חדשים מתן שירות אדמיניסטרטיבי לגורמים בתוך המרפאה שותפות בהשגה ומימוש יעדי המרפאה בתחומי השירות, האיכות הרפואית, גיוס לקוחות, שיווק שירותים ועוד דרישות התפקיד: תעודת בגרות מלאה ניסיון בתפקידי שירות ומכירה - יתרון תודעת שירות גבוהה יחסי אנוש טובים, שיתוף פעולה בצוות ייצוגיות יכולת עבודה בסביבה ממוחשבת יכולת עבודה בתנאי לחץ ועומס שליטה בשפה העברית שליטה בשפה נוספת - יתרון כושר הבעה גבוה בכתב ובע""פ *תינתן עדיפות למועמדים/ות עם מוגבלויות"
