title,company,location,date,url,department,workplace_type,description
רכז/ת בקרת חומרים מסוכנים,מרכז רפואי מאיר,שרון,2026-02-12,https://jobs.clalitapps.co.il/clalit/index.html?ci=0&positionId=48999,מנהל ומטה,,"למרכז רפואי מאיר דרוש/ה רכז/ת בקרת חומרים מסוכנים תיאור התפקיד: בקרה יומית על רכש חומרים מסוכנים ללא היתר ובדיקת הזמנות חריגות בקרה חודשית על חריגות מלאי לחומרים מסוכנים שיש להם היתר חריגה מכמות ריכוז נתונים עבור חומרים מסוכנים על מנת לעמוד בדרישות החוק אחריות לקידום נושאי החומרים המסוכנים בין מוסדות הכללית והמשרד להגנת הסביבה ניהול פורומים למטרת העברת מידע בתחום החומרים המסוכנים למוסדות כללית מעקב אחר: תוקף ההיתר הרעלים, בעל ההיתר, אחראי רעלים ואחר החומרים ומשקלם בכל היתר ניהול גליונות בטיחות SDS באנגלית וגיליונות מקוצרים בעברית ביצוע משימות נוספות בהתאם להנחית המנהל להגנת הסביבה דרישות התפקיד: טכנאי/ת / הנדסאי/ת / אקדמאי/ת - עדיפות למדעי הסביבה תעודת הכשרה לממוני סביבה ולנושא חומרים מסוכנים ניסיון 3 שנים בעבודה עם חומרים מסוכנים עדיפות במערכת הבריאות בוגר/ת קורס בנושא רעלים וטיפול באירועים חריגים יכולת עבודה במערכות ממוחשבות כגון: SAP לוגיסטיקה, מחולל דוחות BW ידע וניסיון במערכות מיחשוב - תכנת office (excel , power point ) ידיעה טובה של השפה העברית ידיעה טובה של השפה האנגלית קריאה וכתיבה יחסי אנוש טובים ויכולת עבודה בצוות *תינתן עדיפות למועמדים/ות עם מוגבלויות"
אח/ות הוספיס בית ליחידות בבאר שבע ועומר,מחוז דרום,"באר שבע , עומר",2026-02-12,https://jobs.clalitapps.co.il/clalit/index.html?ci=0&positionId=48996,אחים ואחיות,,"כללית מרחיבה את שירותיה ומזמינה אותך לגדול איתנו, אם את/ה מחפש/ת עבודה עם השפעה, נתינה ואתגר - מקומך איתנו! דרוש/ה אח/ות ליחידות הוספיס בבאר שבע ועומר יחידת הוספיס בית מטפלת בחולים סופניים במסגרת הבית במטרה לאזן סימפטומים ולשפר את איכות החיים של המטופלים ובני משפחותיהם אחות הוספיס בית היא חלק דומיננטי מהצוות הנותן מענה מקצועי ותמיכתי למטופל ולמשפחתו. יחד עם הצוות המטפל נבנית תוכנית טיפול המתאימה למטופל ולמשפחתו. האחות מרכזת את הטיפול הכוללני במטופל תוך שימוש מושכל במשאבים. דואגת לרצף טיפולי. מקשרת בן מטופל/צוות/משפחה. המענה הוא מתוכנן וכולל גם מענה 24/7. כמו כן האחות מהווה גורם מייעץ ומכוון לצוותים במרפאות הקהילה. פירוט תפקיד אחות הוספיס בית: תיאור התפקיד: ניהול הטיפול במטופל במצבים שיגרתיים ובמצבי חירום והפנייה לגורמי הטיפול הרלוונטים ביצוע אומדן, הערכה ובניית תוכנית טיפול מתאימה יחד עם הצוות המטפל ניהול טיפול תרופתי הפניית המטופל לגורמי טיפול מקצועיים רלוונטים איזון סימפטומים באמצעים תרופתיים ולא תרופתיים מתן מענה מקצועי בהיבט הפיזי והנפשי ושיפור איכות חייהם של המטופלים ובני משפחותיהם לווי המטופל ומשפחתו בשלבים המתקדמים והאחרונים של המחלה טיפול בחולה המורכב הכולל טיפול בנקזים, צנתרים, סטומות, פצעים ועוד תמיכה ולווי המשפחות בשלבי האבל הדרכת צוותים במרפאות הראשוניות, הדרכת סטודנטים לסיעוד/מתמחים ברפואת משפחה דרישות התפקיד: השכלה אקדמית (תואר ראשון) בסיעוד- חובה ניסיון קליני של 5 שנים לפחות - חובה רישיון נהיגה ורכב- חובה תעודת הכשרת על בסיסית באונקולוגיה ו/או מומחית קלינית בטיפול תומך - עדיפות יכולת תכנון וארגון יכולת הבעה בכתב ובע""פ יחסי אנוש טובים *תינתן עדיפות למועמדים/ות עם מוגבלויות"
מתאם/ת שירות מנהלי/ת למרפאות כללית במחוז דרום-בחצי משרה,מחוז דרום,"רוחמה, באר שבע",2026-02-12,https://jobs.clalitapps.co.il/clalit/index.html?ci=0&positionId=48995,מנהל ומטה,,"רוצה עבודה עם שליחות ונתינה? בוא/י לעבוד איתנו! דרוש/ה מתאם/ת שירות מנהלי/ת בחצי משרה זמינות מיידית, נכונות ל-2 פיצולים בשבוע ויום שישי לסירוגין העבודה בשעות הבוקר החל מהשעה 7:30 תיאור התפקיד: מתן שירות פרונטלי וטלפוני ללקוחות המרפאה בנושאים אדמיניסטרטיביים קביעת תורים לרפואה ראשונית ויועצת והכוונת הלקוחות לשירותים הרפואיים המתאימים מתן מידע על זכויות המגיעות ללקוחות טיפול בנושאי גבייה והחזרים כספיים ללקוחות טיפול בקליטת לקוחות חדשים מתן שירות אדמיניסטרטיבי לגורמים בתוך המרפאה: רופאים, אחיות, רוקחים, ובעלי מקצוע נוספים שותפות בהשגה ובמימוש יעדי המרפאה בתחומי השירות, האיכות הרפואית, גיוס לקוחות, שיווק שירותים ועוד דרישות התפקיד: תעודת בגרות מלאה - חובה ניסיון בתפקידי שירות ומכירה - יתרון תודעת שירות גבוהה יחסי אנוש טובים, שיתוף פעולה בצוות ייצוגיות יכולת עבודה בסביבה ממוחשבת יכולת עבודה בתנאי לחץ ועומס שליטה בשפה העברית, שליטה בשפה נוספת - יתרון כושר הבעה גבוה בכתב ובע""פ *תינתן עדיפות למועמדים/ות עם מוגבלויות"
מתאם/ת שירות מנהלי/ת אקדמאי/ת למרפאות כללית במחוז דרום,מחוז דרום,"באר שבע, קריית גת, אשקלון, ביר הדאג",2026-02-12,https://jobs.clalitapps.co.il/clalit/index.html?ci=0&positionId=48994,מנהל ומטה,,"אקדמאי/ת? כללית מחפשת אותך לתפקיד מתאם/ת שירות מנהלי/ת למרפאות במחוז דרום אופק לקידום והתפתחות למתאימים/ות תיאור התפקיד: מתן שירות פרונטלי וטלפוני ללקוחות המרפאה בנושאים אדמיניסטרטיביים קביעת תורים לרפואה ראשונית ויועצת, והכוונת הלקוחות לשירותים הרפואיים המתאימים מתן מידע על זכויות המגיעות ללקוחות, בהתאם לסל השירותים טיפול בנושאי גבייה והחזרים כספיים ללקוחות המרפאה טיפול בקליטת לקוחות חדשים במרפאה מתן שירות אדמיניסטרטיבי לגורמים בתוך המרפאה: רופאים, אחיות, רוקחים, ובעלי מקצוע נוספים שותפות בהשגה ובמימוש יעדי המרפאה בתחומי השירות, האיכות הרפואית, גיוס לקוחות, שיווק שירותים ועוד דרישות התפקיד: תואר אקדמי בניהול מערכות בריאות, כלכלה, תעשייה וניהול, מדעי החברה - חובה עבודה בפיצולים - חובה ניסיון בתפקידי שירות ומכירה - יתרון תודעת שירות גבוהה יחסי אנוש טובים, שיתוף פעולה בצוות יכולת עבודה בסביבה ממוחשבת יכולת עבודה בתנאי לחץ ועומס שליטה בשפה העברית, שליטה בשפה נוספת - יתרון כושר הבעה גבוה בכתב ובע""פ *תינתן עדיפות למועמדים/ות עם מוגבלויות"
מתאם/ת שירות מנהלי/ת  למרפאות כללית במחוז דרום,מחוז דרום,"באר שבע, קריית גת, שדרות, אשקלון",2026-02-12,https://jobs.clalitapps.co.il/clalit/index.html?ci=0&positionId=48993,מנהל ומטה,,"רוצה עבודה עם שליחות ונתינה? בוא/י לעבוד איתנו למרפאות במחוז דרום דרוש/ה מתאם/ת שירות מנהלי/ת תיאור התפקיד: מתן שירות פרונטלי וטלפוני ללקוחות המרפאה בנושאים אדמיניסטרטיביים קביעת תורים לרפואה ראשונית ויועצת, והכוונת הלקוחות לשירותים הרפואיים המתאימים מתן מידע על זכויות המגיעות ללקוחות, בהתאם לסל השירותים טיפול בנושאי גבייה והחזרים כספיים ללקוחות המרפאה טיפול בקליטת לקוחות חדשים במרפאה מתן שירות אדמיניסטרטיבי לגורמים בתוך המרפאה: רופאים, אחיות, רוקחים, ובעלי מקצוע נוספים שותפות בהשגה ובמימוש יעדי המרפאה בתחומי השירות, האיכות הרפואית, גיוס לקוחות, שיווק שירותים ועוד דרישות התפקיד: תעודת בגרות מלאה - חובה ניסיון בתפקידי שירות ומכירה - יתרון תודעת שירות גבוהה יחסי אנוש טובים, שיתוף פעולה בצוות יכולת עבודה בסביבה ממוחשבת יכולת עבודה בתנאי לחץ ועומס שליטה בשפה העברית, שליטה בשפה נוספת - יתרון כושר הבעה גבוה בכתב ובע""פ *תינתן עדיפות למועמדים/ות עם מוגבלויות"
פקיד/ת מרפאה,מחוז מרכז,מודיעין,2026-02-12,https://jobs.clalitapps.co.il/clalit/index.html?ci=0&positionId=48957,מנהל ומטה,,"למרפאה במודיעין דרוש/ה פקיד/ת מרפאה למשרה מלאה שעות עבודה: ימים א-ה משעה 7:30 המשרה כוללת 2 פיצולים בשבוע עד שעה 19:00 תיאור התפקיד: מתן שירות פרונטלי וטלפוני ללקוחות המרפאה בנושאים אדמיניסטרטיביים קביעת תורים לרפואה ראשונית ויועצת והכוונת הלקוחות לשירותים הרפואיים המתאימים מתן מידע על זכויות המגיעות ללקוחות בהתאם לסל השירותים טיפול בנושאי גבייה והחזרים כספיים ללקוחות המרפאה טיפול בקליטת לקוחות חדשים במרפאה מתן שירות אדמיניסטרטיבי לצוות הרפואי במרפאה שותפות בהשגה ובמימוש יעדי המרפאה בתחומי השירות, האיכות הרפואית, גיוס לקוחות, שיווק שירותים ועוד דרישות התפקיד: תעודת בגרות מלאה - חובה ניסיון בתפקידי שירות ומכירה - יתרון תודעת שירות גבוהה יחסי אנוש טובים, שיתוף פעולה בצוות יכולת עבודה בסביבה ממוחשבת יכולת עבודה בתנאי לחץ ועומס שליטה בשפה העברית, שליטה בשפה נוספת - יתרון כושר הבעה גבוה בכתב ובע""פ *תינתן עדיפות למועמדים/ות עם מוגבלויות"
רוקח/ת,מחוז שרון שומרון,עמנואל,2026-02-11,https://jobs.clalitapps.co.il/clalit/index.html?ci=0&positionId=48954,רוקחות,,"למרפאה ייחודית ביישוב עמנואל דרוש/ה רוקח/ת לבית מרקחת ב- 75% משרה אנו מציעים גמישות, שכר מתגמל ותנאים מעולים תיאור התפקיד: ניפוק תרופות על פי מרשמים הניתנים על ידי הרופאים גביית תשלום עבור התרופות בהתאם לנהלים ביצוע ייעוץ רוקחי בדלפק - שימוש בתרופות ללקוחות ביצוע הדרכה רוקחית בפגישה פרטנית עם הלקוח ייעוץ ללקוחות בבחירת תרופות O.T.C והדרכתם לגבי השימוש בהן סיוע בארגון הלוגיסטי של בית המרקחת, אחסון וסידור התרופות על פי הכללים, סידור מדפים חיצוניים, תמחור ומענה טלפוני היכרות ועמידה בדרישות משרד הבריאות בהתנהלות בבית המרקחת תיתכן החלפת הרוקח האחראי במטלות מרפאתיות כגון: ישיבות צוות או פרויקטים מרפאתיים אחרים השתתפות בפרויקטים שהמרפאה מובילה בהתאם להחלטת הרוקח האחראי ביצוע מטלות נוספות בהתאם להנחיות הממונה דרישות התפקיד: השכלה אקדמית (תואר ראשון) ברוקחות רישיון עיסוק ברוקחות (משרד הבריאות) ידע מקצועי נרחב ידיעת השפה העברית על בורייה ידיעת השפה האנגלית כדי קריאת ספרות מקצועית יכולת עבודה בצוות יחסי אנוש טובים תודעת שירות *תינתן עדיפות למועמדים/ות עם מוגבלויות"
פסיכולוג/ית מומחה/ית,מחוז מרכז,"רמלה, מודיעין, ראשון לציון , קרית מלאכי ואשדוד",2026-02-11,https://jobs.clalitapps.co.il/clalit/index.html?ci=0&positionId=48952,פסיכולוגיה,,"למרפאות לבריאות הנפש לילדים ונוער במחוז מרכז, בערים: רמלה, מודיעין, ראשון לציון , קרית מלאכי ואשדוד דרושים/ות פסיכולוגים/ות קליניים/ות מומחים/ות העבודה במרפאות כוללת השתייכות לצוות רב מקצועי, חשיפה למגוון גישות טיפוליות ופסיכופתולוגיות רחבות ואפשרות לשלב עבודה פרטנית, קבוצתית, התערבות במשבר וראיון קליני לאוכלוסייה העבודה כמומחה/ית במחוז כוללת השתלבות בישיבות צוות וחשיבה קלינית משותפת מעמיקה, סמינר תיאורטי, הכשרות והשתלמויות בתוך המרפאה וכחלק מהמחוז וכללית , וכך למידה ומעטפת קלינית עשירה. ישנן גם הזדמנויות לגדילה לתפקידי ניהול ואחריות שונים וכן אפשרות להסמכה להדרכה. תנאי השכר מתגמלים בהתאם להסכמי השכר החדשים תיאור התפקיד: ביצוע ראיונות ואבחונים פסיכולוגיים וקביעת תוכנית טיפולית ביצוע טיפולים פרטניים, קבוצתיים, זוגיים או משפחתיים השתתפות בישיבות צוות רב מקצועי והצגת ההיבט המקצועי בתחומי האבחון והטיפול הפסיכולוגיים קשרים עם גורמים מקצועיים שונים בתוך ומחוץ לארגון (צוות רפואי, מוסדות חינוך, גורמי רווחה) אפשרות ליזום ולהשתתף במחקרים פסיכולוגיים השתתפות בימי עיון, בהשתלמויות מקצועיות ובהדרכת סטודנטים דרישות התפקיד : תואר שני לפחות בפסיכולוגיה רישום כפסיכולוג/ית מומחה/ית בפנקס הפסיכולוגים של משרד הבריאות יחסי אנוש טובים ויכולת עבודה בצוות *תינתן עדיפות למועמדים/ות עם מוגבלויות"
רוקח/ת,מחוז מרכז,רחובות,2026-02-09,https://jobs.clalitapps.co.il/clalit/index.html?ci=0&positionId=48945,רוקחות,,"לבית מרקחת ברחובות דרוש/ה רוקח/ת למישרה חלקית/מלאה תיאור התפקיד: ניפוק תרופות על פי מרשמים הניתנים על ידי הרופאים גביית תשלום עבור התרופות בהתאם לנהלים ביצוע ייעוץ רוקחי בדלפק - שימוש בתרופות ללקוחות ביצוע הדרכה רוקחית בפגישה פרטנית עם הלקוח ייעוץ ללקוחות בבחירת תרופות O.T.C והדרכתם לגבי השימוש בהן סיוע בארגון הלוגיסטי של בית המרקחת, אחסון וסידור התרופות על פי הכללים, סידור מדפים חיצוניים, תמחור ומענה טלפוני היכרות ועמידה בדרישות משרד הבריאות בהתנהלות בבית המרקחת תיתכן החלפת הרוקח האחראי במטלות מרפאתיות כגון: ישיבות צוות או פרויקטים מרפאתיים אחרים השתתפות בפרויקטים שהמרפאה מובילה, בהתאם להחלטת הרוקח האחראי ביצוע מטלות נוספות בהתאם להנחיות הממונה דרישות התפקיד: השכלה אקדמית (תואר ראשון) ברוקחות רישיון עיסוק ברוקחות (משרד הבריאות) ידע מקצועי נרחב ידיעת השפה העברית על בורייה ידיעת השפה האנגלית כדי קריאת ספרות מקצועית יכולת עבודה בצוות יחסי אנוש טובים תודעת שירות *תינתן עדיפות למועמדים/ות עם מוגבלויות"
מנהל/ת שיווק ושירות מחוזי/ת,כללית,נתניה,2026-02-09,https://jobs.clalitapps.co.il/clalit/index.html?ci=0&positionId=48946,מנהל ומטה,,"למחוז שרון שומרון דרוש/ה מנהל/ת שיווק ושירות כפיפות: הנהלת מחוז כפיפות מקצועית : סמנכ ""ל וראש חטיבת השירות והשיווק תיאור התפקיד: גיבוש תחזיות יעדים ותוכניות לפעילות השיווקית והשירותית במחוז ואחריות ליישומה בפועל אחריות לעמידה ביעדי מאזן לקוחות, יעדי שירות, יעדי תדמית ביצוע התאמה מקומית של האסטרטגיה השיווקית גיבוש תוכניות שיווק ושירות לערי המחוז ואחריות ליישומן והטמעתן אחריות להעלאת מודעות פנימית לנושאי שיווק ושירות ולהכנה והפצה חיצונית של מידע על הארגון ושירותיו אחריות על התקשורת השיווקית אחריות להנחיה מקצועית של צוותי המנהלות והמרפאות בתחומי האחריות - שיווק ושירות אחריות לקידום איכות השירות וחווית המטופל והטמעת תרבות ארגונית ממוקדת מטופל אחריות לתכנון מתווה תהליכים לעיצוב ושיפור חווית מטופל במחוז אחריות לניהול מוקדי קשרי לקוחות אחריות לניהול צוותים פנימיים וחיצוניים (מיקור חוץ) בתחומי האחריות - הנחיה, חלוקת מטלות, סיוע, הדרכה וביצוע בקרה אחר ביצועים טיפול בהיבטים מנהלתיים הכרוכים באחריות הכוללת על מערך השיווק והשירות במחוז חברות בפורום ההנהלה במוסד דרישות התפקיד: השכלה אקדמית (תואר ראשון) במינהל עסקים, ניהול מערכות בריאות, או הנדסת תעשיה וניהול, מדעי החברה. יתרון לתואר שני בתחומים אלו והתמחות בשיווק ניסיון קודם של 5 שנים ומעלה בניהול מערך שירות ושיווק רחב היקף ואינטגרטיבי ניסיון בתחום הבריאות ובארגון עצמו - יתרון ידע מקצועי נרחב ועדכני בתחומי השיווק והשירות ידע בתחום הבריאות - יתרון ידע בהפעלת מאגרי מידע ידע בהפעלת מערכות ותוכנות מחשב רלוונטיות ידיעת השפה העברית רצוי ידע של שפות זרות (אנגלית, רוסית, ערבית) ידע בהפעלת מחשב אישי יכולת ניהול וארגון יכולת הובלת שינויים מודעות לשיווק ושירות ראייה לטווח ארוך יכולת הנעת עובדים *תינתן עדיפות למועמדים/ות עם מוגבלויות"
עובד/ת מחסן ציוד רפואי,מרכז רפואי מאיר,שרון,2026-02-05,https://jobs.clalitapps.co.il/clalit/index.html?ci=0&positionId=48456,מנהל ומטה,,"למרכז הרפואי מאיר דרוש/ה עובד/ת למחסן ציוד רפואי תיאור התפקיד: הנפקת טובין עפ""י תקן/דרישה: הכנת שובר ניפוק, ליקוט והעברת הטובין עפ""י נהלים, החתמת הלקוח על שוברי ניפוק וביצוע ניפוקי דלפק להשלמת חסרים ניהול מלאי המחסן עפ""י נהלים מקצועיים: ביצוע בדיקות קבלה כמותיות, איכותיות לתאימות ותקינות הטובין, הפרדת פריטים לא תקינים, וביצוע ספירות מלאי מדגמיות ועוד אחסון טובין עפ""י נהלים וכללים: סידור מדפים לפי איתור ו- FIFO , ארגון וסידור המחסן ושמירה על סדר וניקיון כולל שמירת מעברים פנויים ביצוע עבודה עפ""י נהלים: היכרות תיק הנהלים והוראות העבודה, התעדכנות וביצוע ריענון בשינויים דרישות התפקיד: השכלה תיכונית/מקצועית ניסיון של 3 חודשים בעבודות מחסן ידיעה טובה של השפה העברית והשפה האנגלית ברמה בסיסית תודעת שירות יכולת ומוטיבציה ללמידה הכרת מערכת ה- SAP - יתרון יכולת עבודה פיסית רישיון מלגזה - יתרון כושר ביטוי - בעל פה ובכתב יחסי אנוש טובים *תינתן עדיפות למועמדים/ות עם מוגבלויות"
