title,company,location,date,url,department,workplace_type,description
פרח רוקחות,מחוז מרכז,מודיעין,2026-04-14,https://jobs.clalitapps.co.il/clalit/index.html?ci=0&positionId=49171,אחזקה ולוגיסטיקה,,"לבתי מרקחת באיזור מודיעין דרוש/ה עובד טכני בבית מרקחת - פרח רוקחות תיאור התפקיד: סיוע לרוקחים בבית מרקחת הקלדת נתוני תרופות למחשב עבודה על הקופה, עזרה בדלפק סידור תרופות ומוצרים משלימים על מדפים הדבקת מחירים על תכשירים קבלה וסידור תרופות מענה טלפוני מתן שירות ללקוחות עבודות תחזוקה של בית המרקחת דרישות התפקיד : בגרות מלאה ידיעת אנגלית ברמה טובה נכונות לעבודה בפיצולים/משמרות ערב *תינתן עדיפות למועמדים/ות עם מוגבלויות"
רכז/ת פרט ושכר,מחוז מרכז,ראשון לציון,2026-04-14,https://jobs.clalitapps.co.il/clalit/index.html?ci=0&positionId=49217,מנהל ומטה,,"למחוז מרכז של כללית, דרוש/ה רכז/ת פרט ושכר - משרה מלאה, החלפה לחופשת לידה (משרה זמנית ל-9 חודשים) תיאור התפקיד: טיפול כוללני בעובד מקליטתו לעבודה ועד פרישתו מהארגון, כולל טיפול בעדכונים שוטפים בתחומי כ""א ושכר של העובד (קרנות השתלמות, פנסיה, שעות נוספות, תנאים סוציאליים, החזר הוצאות ונושאי פרט נוספים) מתן שירות פרונטלי וטלפוני לעובדי המחוז ביצוע מעקבים שוטפים בנושא תקן/איוש, קביעות, ותק וכדומה הפקת אישורים שונים לעובדים ביצוע בקרה ומעקב, טיפול בבירורים בנושא זכאויות שכר הפקת תלושי שכר (בדיקה, הפצה וטיפול בבירורים) ביצוע מטלות נוספות בהתאם להוראות הממונה דרישות התפקיד : תואר ראשון במשאבי אנוש או במדעי החברה נסיון של שנתיים לפחות בתחום כח אדם ושכר הכשרה וידע בשימוש במערכות מידע ממוחשבות בתחום כח אדם - sap-hr שליטה מלאה בתוכנות Office שליטה בדיני עבודה כושר הבעה בכתב ובעל פה יחסי אנוש טובים ויכולת עבודה בצוות *תינתן עדיפות למועמדים/ות עם מוגבלויות"
פקיד/ה למנהל תחום החרדים,מחוז ירושלים,גבעת שאול - ירושלים,2026-04-14,https://jobs.clalitapps.co.il/clalit/index.html?ci=0&positionId=49194,מנהל ומטה,,"דרוש/ה מזכיר/ת לשכה למנהל תחום האוכלוסיה החרדית במטה מחוז ירושלים, החלפה בחל""ד משרה מלאה - 40 ש""ש, ימי א'-ה' 8.00-16.00 עם מידה של גמישות בשעות תיאור התפקיד: מתן שירות אדמיניסטרטיבי - ניהול יומן, טיפול בתכתובות, הכנת מצגות ודוחות עזרה בטיפול בנושאי כוח אדם - זימן מועמדים לראיונות, קשר עם משאבי אנוש מתן מענה לצוותי המרפאות מועמדים/ות מתאימים/ות יעברו תהליך מיון הכולל ראיונות ומבחני מחשב דרישות התפקיד: תעודת בגרות מלאה/חוצים מלאים - חובה ניסיון באדמיניסטרציה יחסי אנוש טובים, שיתוף פעולה בצוות יכולת עבודה בסביבה ממוחשבת ובתנאי לחץ ועומס ידע בתוכנות Office *תינתן עדיפות למועמדים/ות עם מוגבלויות"
מזכיר/ה רפואי/ת,מרכז שניידר לרפואת ילדים בישראל,גוש דן,2026-04-14,https://jobs.clalitapps.co.il/clalit/index.html?ci=0&positionId=49214,מנהל ומטה,,"למרכז הרפואי שניידר דרוש/ה מזכיר/ה רפואי/ת במלר""ד למשרה חלקית, עבודה במשמרות כולל סופ""ש תיאור התפקיד: טיפול אדמיניסטרטיבי בקבלה ובשחרור מטופלים דחופים המגיעים למלר""ד טיפול אדמיניסטרטיבי באשפוז מטופלים במחלקות בית החולים מתן שירות פרונטאלי וטלפוני בנושאים אדמיניסטרטיביים למטופלים ובני משפחותיהם תמיכה אדמיניסטרטיבית בצוות רפואי וסיעודי במחלקה קיום ממשקי עבודה עם כל יחידות בית החולים לצורך קידום הטיפול במטופל (מחלקות אשפוז, מרפאות חוץ, יחידות דימות, מעבדות, יחידת הסניטרים ועוד) טיפול בנושאים כספיים, גבייה והחזרים תיעוד ודיווח על פעולות שבוצעו במרפאה במערכות ממוחשבות עבודה משרדית שוטפת: הכנת תיקים, תיוק, סריקה, הנפקת מדבקות, טיפול בדואר, הזמנת ציוד חצי משרה, העבודה בכל ימות השבוע במשמרות בוקר, ערב, לילה דרישות התפקיד: תעודת בגרות מלאה תעודת מזכירות רפואית- יתרון ניסיון בעבודת מזכירות בתחום הרפואה - יתרון שליטה מלאה בשפה העברית ידיעה של שפה נוספות - יתרון שליטה במחשב ובתוכנות Office כושר ארגון, תפעול וקידום תהליכים תודעת שירות גבוהה תקשורת בין אישית טובה ויכולת עבודה בצוות יכולת ביטוי טובה בעל פה ובכתב *תינתן עדיפות למועמדים/ות עם מוגבלויות"
פרח רוקחות,מחוז שרון שומרון,הרצליה,2026-04-14,https://jobs.clalitapps.co.il/clalit/index.html?ci=0&positionId=49210,אחזקה ולוגיסטיקה,,לבתי מרקחת בהרצליה דרוש/ה פרח רוקחות תיאור התפקיד: אחריות על סידור בית המרקחת קבלת/פריקת סחורה טיפול בתרופות שאינן בתוקף ליקוט תרופות מענה טלפוני דרישות התפקיד: בגרות מלאה יחסי אנוש טובים שיתוף פעולה בצוות יכולת עבודה בסביבה ממוחשבת יכולת עבודה בתנאי לחץ ועומס *תינתן עדיפות למועמדים/ות עם מוגבלויות
רוקח/ת,מחוז שרון שומרון,"רמת השרון, הרצליה, רעננה וכפר סבא",2026-04-14,https://jobs.clalitapps.co.il/clalit/index.html?ci=0&positionId=49037,רוקחות,,"לבתי המרקחת ברמת השרון, הרצליה, רעננה וכפר סבא דרוש/ה רוקח/ת לסיוע ותיגבור בבתי מרקחת תיאור התפקיד: ניפוק תרופות על פי מרשמים הניתנים על ידי הרופאים גביית תשלום עבור התרופות בהתאם לנהלים ביצוע ייעוץ רוקחי בדלפק - שימוש בתרופות ללקוחות ביצוע הדרכה רוקחית בפגישה פרטנית עם הלקוח ייעוץ ללקוחות בבחירת תרופות O.T.C והדרכתם לגבי השימוש בהן סיוע בארגון הלוגיסטי של בית המרקחת, אחסון וסידור התרופות על פי הכללים, סידור מדפים חיצוניים, תמחור ומענה טלפוני היכרות ועמידה בדרישות משרד הבריאות בהתנהלות בבית המרקחת תיתכן החלפת הרוקח האחראי במטלות מרפאתיות כגון: ישיבות צוות או פרויקטים מרפאתיים אחרים השתתפות בפרויקטים שהמרפאה מובילה, בהתאם להחלטת הרוקח האחראי ביצוע מטלות נוספות בהתאם להנחיות הממונה דרישות התפקיד: השכלה אקדמית (תואר ראשון) ברוקחות רישיון עיסוק ברוקחות (משרד הבריאות) ידע מקצועי נרחב ידיעת השפה העברית על בורייה ידיעת השפה האנגלית כדי קריאת ספרות מקצועית יכולת עבודה בצוות יחסי אנוש טובים תודעת שירות *תינתן עדיפות למועמדים/ות עם מוגבלויות"
רופא/ה פסיכיאטר/ית Psychiatrist,מחוז שרון שומרון,חדרה,2026-04-14,https://jobs.clalitapps.co.il/clalit/index.html?ci=0&positionId=49207,רפואה,,"למרפאת בריאות הנפש - חדרה מבוגרים דרוש/ה פסיכיאטר/ית תפקיד מגוון, אפשריות לקידום, הכשרות מקצועיות ועבודה בסביבה רב מקצועית, דינמית ומתפתחת משרה מלאה/חלקית תיאור התפקיד : ביצוע אבחונים, בניית תוכניות טיפול ומתן טיפול למטופלים במרפאה השתתפות בישיבות ובדיונים בנושאים מקצועיים או מקרים פרטניים ווועדות שונות העברת מידע רפואי, בכתב או בעל פה, בהתאם לדרישות ולנהלים עבודה מול גורמי קהילה וגופים חיצוניים לצורך ייעוץ ושיתוף פעולה הדרכה, מחקר ופעילות אקדמית על פי הצורך השתלבות בפעילויות המחוז בהתאם לנהלים, להסכמים והצרכים קיום מפגשים עם מטופלים ובני משפחה לאיסוף ומתן מידע התעדכנות מקצועית שוטפת ביצוע משימות נוספות לפי הנחיות הממונה דרישות התפקיד : תואר M.D. ברפואה רישיון ישראלי לעסוק ברפואה ידע מקצועי נרחב ועדכני בתחום הפעילות המקצועית (המומחיות) הכרת החוקים, התקנות והנהלים הרלוונטיים ידע בהפעלת מערכות מחשב רלוונטיות ידיעה טובה של השפה העברית ידיעה טובה של השפה האנגלית (כדי קריאת ספרות מקצועית לפחות) רצויה ידיעת שפות נוספות (דיבור) מקצוענות אבחנתית וביצועית יכולת שיתוף פעולה בצוות תקשורת בין אישית טובה סבלנות ואמפתיה לזולת *תינתן עדיפות למועמדים/ות עם מוגבלויות"
קלינאי/ת תקשורת,מחוז שרון שומרון,"רעננה, חדרה וחריש",2026-04-14,https://jobs.clalitapps.co.il/clalit/index.html?ci=0&positionId=49065,קלינאות תקשורת,,"דרוש/ה קלינאי/ת תקשורת למכון התפתחות הילד ברעננה ובחדרה תיאור התפקיד: ביצוע אבחונים לתינוקות ולילדים עד גיל 9 בתחומי שפה, תקשורת, דיבור, אכילה קביעת תוכנית טיפולית וטיפול בהתאם לממצאי האבחון בתחום השפה והדיבור - ילדים: אבחון והערכה של שפה, היגוי, קול, הפרעות בקצב הדיבור, בעיות פונקציונאליות ואורגניות קביעת תוכנית טיפולית וטיפול בהתאם לממצאי האבחון/הערכה לקיחת חלק פעיל בעבודת צוות מקצועי ורב מקצועי השתתפות בימי עיון והשתלמויות, התעדכנות בחידושים מקצועיים אפשרות להשתתפות בפרויקטים ובמחקרים דרישות התפקיד : תואר ראשון בקלינאות תקשורת רשיון עיסוק במקצוע - תעודת הכרה במעמד של משרד הבריאות עברית ברמת שפת אם שליטה באנגלית כדי קריאת ספרות מקצועית כושר הבעה בכתב ובעל פה יכולת עבודה בסביבה ממוחשבת יחסי אנוש טובים ויכולת עבודה בצוות עדיפות לניסיון בתחום התפתחות הילד/עבודה עם ילדים בגיל הרך *תינתן עדיפות למועמדים/ות עם מוגבלויות"
רופא/ה פרילנסר/ית למרפאה לשיקום מיני- Sexual Rehabilitation Physician,מרכז רפואי לשיקום לוינשטיין,השרון,2026-04-14,https://jobs.clalitapps.co.il/clalit/index.html?ci=0&positionId=48736,רפואה,,"למרכז הרפואי לשיקום לוינשטיין דרוש/ה רופא/ה פרילנסר/ית למרפאה לשיקום מיני בהיקף של כ-52 שעות חודשיות כנגד חשבונית (פרילנסר) ליומיים עבודה בשבוע עבודה טיפולית מרתקת מאתגרת ומפתחת בצוות רב מקצועי תיאור התפקיד: ניהול מרפאה מוכרת להדרכה ע""י איט""ם בטיפול מיני טיפול בפניות מהקהילה הכוללים ביצוע אינטייקים, הפניה למתמחה, הדרכת המתמחה בטיפול פניות מהמרכז הרפואי לוינשטיין ממחלקות האשפוז ואשפוז יום למתן יעוץ וטיפול מיני והמשך הפניה לטיפול מתמחים בטיפול מיני והדרכה על טיפולים ביצוע ישיבות צוות אחת לשבוע + הדרכה פרטנית אחת לשבוע לכל מתמחה. קידום השרות הסקסולוגי הכולל מתן הרצאות לצוותי רפואה ופרא רפואה לוינשטיין פרסום וקידום המרפאה בקהילה ובקופות החולים דרישות התפקיד: השכלה אקדמית- רופא/ה שעבר הסמכה בתחום השיקום המיני אישור על הכשרה הסמכה/הכשרה בתחום השיקום המיני ניסיון של שלוש שנים לפחות בעבודה במוסד טיפולי יכולת לעבודה בצוות רב מקצועי מוכנות גבוהה ללמידה והתפתחות *תינתן עדיפות למועמדים/ות עם מוגבלויות"
עובד/ת סוציאלי/ת ליחידת קשב,מחוז דן פתח תקווה,גוש דן,2026-04-14,https://jobs.clalitapps.co.il/clalit/index.html?ci=0&positionId=49144,עבודה סוציאלית,,"תיאור התפקיד: טיפול פרטני וקבוצתי בילדים, בני נוער והוריהם, ליווי והדרכת הורים עבודה בצוות רב מקצועי, בניית תוכנית טיפול מותאמת אישית, קשר עם מסגרות חינוכיות וגורמי קהילה השתתפות בישיבות צוות והדרכות מקצועיות דרישות התפקיד : תואר שני בעבודה סוציאלית ניסיון בעבודה עם ילדים ובני נוער - יתרון היכרות עם תחום הפרעת קשב וריכוז - יתרון משמעותי עבודה בצוות לצד עצמאות מקצועית מובטחת סביבה מקצועית, הדרכה מקצועית שוטפת והכשרות מקצועיות *תינתן עדיפות למועמדים/ות עם מוגבלויות"
הנדסאי.ת חשמל - מתח גבוה,מרכז רפואי כרמל,מרכז רפואי כרמל- חיפה,2026-04-13,https://jobs.clalitapps.co.il/clalit/index.html?ci=0&positionId=49173,אחזקה ולוגיסטיקה,,"למרכז הרפואי כרמל דרוש/ה הנדסאי.ת חשמל עם ניסיון במתח גבוה תיאור התפקיד: ביצוע עבודות תיקונים והתקנות לפי הוראות הממונה דיווח על עבודות שבוצעו בטפסי מחשב ויומנים נהוגים דרישות התפקיד: הנדסאי.ת חשמל- חובה! בוגר/ת בי""ס מקצועי במקצוע החשמל רישיון חשמלאי/ת מוסמך/ת בתוקף (משרד התמ""ת) ניסיון של 5 שנים בעבודות אחזקת מערכות חשמל בביניינים ובתעשיה עבודה במתח כ=גבוה- חובה! ידע בקריאת תוכניות חשמל במיבנים ובקריאת תוכניות פיקוד הכרת מערכות החשמל בבית החולים ידיעת השפה העברית (כדי הגשת דיווח על עבודות שביצע) *תינתן עדיפות למועמדים/ות עם מוגבלויות"
מנהל/ת מרכז בריאות האישה,מחוז מרכז,אשדוד,2026-04-13,https://jobs.clalitapps.co.il/clalit/index.html?ci=0&positionId=49209,רפואה,,"דרוש/ה מנהל/ת מרכז בריאות האישה - רופא/ה מומחה/ית ברפואת נשים תיאור תפקיד : ניהול המרפאה ומתן שרותי רפואת נשים באיכות ובזמינות האופטימליים, בהתאם לנהלים ולהנחיות הנהלת המחוז ניהול השירות והאיכות הרפואית במרפאה בשיתוף עם הצוות המוביל הובלת תהליכים לשיפור והרחבת שירותים בהתאם להחלטות הנהלת המחוז ובתיאום עם המינהלת איתור רופאים ומלווה את כניסתם לתפקיד שותפות לתהליכים המבטיחים זמינות שירותים, בין היתר באמצעות קשר עם מוסדות רפואיים בכללית ומחוץ לכללית יוזמה לתהליכים בחיבור המרפאה לקהילת המטופלים ניהול המערך התקציבי תוך ניצול אופטימלי של המשאבים טיפול בתלונות ובבירורים של מבוטחים בתחום הרפואי ווידא ביצוע הרשומה הרפואית בתיקים הרפואיים של מבוטחי המרפאה דרישות התפקיד: רופא/ה מומחה ברפואת נשים בעל/ת רישיון ישראלי לעיסוק ברפואה ניסיון של 3 שנים כרופא/ת נשים כושר ארגון ופיקוח על צוות עובדים כושר הבעה בכתב ובעל-פה כושר הדרכה יחסי אנוש יחסי עבודה תקינים ידיעת השפה העברית על בוריה ושפה זרה נוספת *תינתן עדיפות למועמדים/ות עם מוגבלויות"
רפרנט/ית מכרזים והתקשרויות,הנהלה ראשית,תל אביב,2026-04-13,https://jobs.clalitapps.co.il/clalit/index.html?ci=0&positionId=49045,מנהל ומטה,,"להנהלה ראשית דרוש/ה רפרנט/ית מכרזים והתקשרויות - מינהל תשתיות ובינוי - חטיבת לוגיסטיקה ותשתיות תיאור התפקיד : הכנת מכרזים לפרסום (הכנת מסמכים משפטיים והתאמתם למכרז ולדרישות הייחודיות בפרויקט, ריכוז כל החומר המקצועי והתכנוני, הגשת החומר לאישור ועדת המכרזים והעלאת הקבצים לפרסום באינטרנט) הכנה ופרסום מכרזים למוסדות ביצוע התקשרויות עם קבלנים (החתמת חוזה, הכנת הזמנת עבודה, אישור תקציב, צו התחלת עבודה) הפקת הזמנות, הגדלת הזמנות לקבלנים כולל מעקב אחר התקדמות הפרויקט עידכון מאסטר המסמכים המשפטיים טיפול באופן שוטף ברישום קבלנים חדשים ועדכון רשימת הקבלנים המאושרים של הבינוי טיפול באופן שוטף במאגר חוות דעת על קבלנים: ריכוז חוות הדעת על הקבלנים והקלדתם למאגר דיווח על פרויקטים מעל 40 מש""ח לביצוע מכרז לביטוח אחריות לעדכון שוטף ממוחשב של סטטוס מכרזים פתוחים אחריות לעדכון שוטף ממוחשב על מכרזים המנוהלים במדור לגורמים במינהל תשתיות ובינוי למוסדות כללית אחריות לניהול ותחזוקת אתר שיתוף ידע למכרזי בינוי מול מוסדות בכללית דרישות התפקיד : השכלה תיכונית מלאה (תעודת בגרות), רצוי - השכלה אקדמית (תואר ראשון) במדעי החברה ידע מקצועי מעשי של ביצוע מטלות העיסוק הכרת החוקים, התקנות והנהלים הרלוונטיים לנושאי הפעילות ידע בתפעול מערכות מחשוב רלוונטיות לעיסוק ידיעה טובה של השפה העברית ידיעה, בעיקר קריאה, של אנגלית טכנית הקפדה על פרטים ודיוק הקפדה על נהלים ותקנות אמינות ויושר דיסקרטיות עמידה בלחץ והתנגדות תקשורת בין אישית טובה *תינתן עדיפות למועמדים/ות עם מוגבלויות"
מזכיר/ה לבית מרקחת,מרכז רפואי קפלן,רחובות,2026-04-13,https://jobs.clalitapps.co.il/clalit/index.html?ci=0&positionId=49104,מנהל ומטה,,"למרכז רפואי קפלן דרוש/ה מזכיר/ה לבית המרקחת המוסדי - משרה מלאה תיאור התפקיד: ביצוע מכלול פעילויות המזכירות השונות הכולל: טיפול בדואר נכנס ויוצא, הדפסת חומר מגוון, תיוק, מענה טלפוני וכו' ריכוז והכנת חומר מגוון עבור ישיבות, ועדות או טיפול אחר בהתאם להנחיית המנהלת ליצור קשר עם גורמים שונים במוסד ומוחצה לו דרישות התפקיד: השכלה תיכונית כולל תעודת בגרות מלאה בוגר/ת קורס מוכר למזכירות שליטה מלאה בשפות עברית ואנגלית ידיעת השפה העברית על בורייה שליטה מלאה בתוכנות oficce שליטה במערכות ממוחשבות כולל SAP תקשורת בין אישית טובה ויכולת עבודה בצוות יכולת לעבוד בעומס וריבוי משימות לעיתים תחת לחץ יכולת ביטוי טובה בעל פה ובכתב *תינתן עדיפות למועמדים/ות עם מוגבלויות"
מזכיר/ה למרפאה,מרכז לבריאות הנפש שלוותה,הוד השרון,2026-04-13,https://jobs.clalitapps.co.il/clalit/index.html?ci=0&positionId=49047,מנהל ומטה,,"למרפאת קמה, לטיפול בטראומה ואובדן דרוש/ה מזכיר/ה במשרה מלאה תיאור התפקיד: אחריות למענה אדמיניסטרטיבי במרפאה עבודה משותפת עם הצוות הקליני במרפאה עמידה במדדים טיפול בנושא התורים במרפאה: זימון/ביטול/הזזה/מידע על תורים וכו' טיפול בבירורים וחריגים שונים מענה טלפוני במרפאה טיפול במנויים של מטופלים ושמירה על איזון תקציבי ביצוע מטלות משרדיות נוספות בהתאם לצורך והנחיות הממונה דרישות התפקיד: תעודת בגרות מלאה - חובה השכלה אקדמית - יתרון תודעת שירות ידיעת השפה העברית על בוריה ושליטה חלקית בשפה האנגלית ידע בהפעלת מחשב הכרת נהלים ותקנות (בתחומים הרלוונטיים) כושר ביטוי בע""פ ובכתב יחסי אנוש טובים עבודה צוות *תינתן עדיפות למועמדים/ות עם מוגבלויות"
מתאמ/ת תיירות מרפא,מרכז שניידר לרפואת ילדים בישראל,פתח תקווה,2026-04-13,https://jobs.clalitapps.co.il/clalit/index.html?ci=0&positionId=49196,מנהל ומטה,,"למרכז הרפואי שניידר דרוש/ה מתאמ/ת תיירות מרפא ימים א'-ה' 08:00-16:00 תיאור התפקיד: תיאום בין הלקוחות סוכני תיירות/תיירים לבין נותני שירות רפואי בביה""ח וניהול תיקי המטופלים. אחריות לתיאום תורים עבור התיירים לייעוץ, בדיקות וניתוחים, בבי""ח ומחוצה לו אחריות על ליווי הלקוח בעת שהותו במרכז הרפואי ומעקב אחר השירותים הניתנים לו, כולל תרגום בעל פה ובכתב מתן הצעות מחיר ללקוחות, מעקב אחר מתן השירותים והכנת דוחות חודשיים דרישות התפקיד: השכלה אקדמית/הנהלת חשבונות - רצוי ידיעת השפה העברית על בורייה וידיעת שפה רוסית (שפת אם) ידיעה טובה של השפה האנגלית יחסי אנוש טובים ויכולת עבודה בצוות רצוי ניסיון בשרות לקוחות שליטה בתוכנות OFFICE ויישומי מחשב נוספים *תינתן עדיפות למועמדים/ות עם מוגבלויות"
