title,company,location,date,url,department,workplace_type
QA Engineer בחברת סטארט-אפ בתחום ה-Digital Twin Software,GotFriends,Tel Aviv,2026-05-10,https://www.gotfriends.co.il/jobslobby/qa/qa-positions/153705/,QA & Automation,Hybrid
Automation Team Lead בחברת סטארט-אפ העוסקת בסייבר התקפי,GotFriends,Tel Aviv,2026-05-10,https://www.gotfriends.co.il/jobslobby/qa/head-of-qa-team/153688/,QA & Automation,Hybrid
QA Engineer בחברה ותיקה ומצליחה,GotFriends,Tel Aviv,2026-05-10,https://www.gotfriends.co.il/jobslobby/qa/qa-positions/153368/,QA & Automation,Hybrid
QA and Automation Manager בחברה פרטית,GotFriends,Tel Aviv,2026-05-10,https://www.gotfriends.co.il/jobslobby/qa/automation-developer/153362/,QA & Automation,Hybrid
QA Automation בחברת מחקר בוטיקית בשוק הסייבר ההתקפי,GotFriends,Tel Aviv,2026-05-10,https://www.gotfriends.co.il/jobslobby/qa/automation-developer/153237/,QA & Automation,Hybrid
Automation Manager בחברת Cyber,GotFriends,Tel Aviv,2026-05-10,https://www.gotfriends.co.il/jobslobby/qa/head-of-qa-team/153022/,QA & Automation,Hybrid
QA Engineer בחברת משחקים אמריקאית,GotFriends,Tel Aviv,2026-05-10,https://www.gotfriends.co.il/jobslobby/qa/qa-positions/152996/,QA & Automation,Remote
QA Automation Team Lead בחברת סטארט-אפ,GotFriends,Tel Aviv,2026-05-10,https://www.gotfriends.co.il/jobslobby/qa/head-of-qa-team/152899/,QA & Automation,Hybrid
QA Automation Engineer- Agent DLP בחברת סטארט-אפ בתחום ה- Data Security,GotFriends,Tel Aviv,2026-05-10,https://www.gotfriends.co.il/jobslobby/qa/automation-developer/152862/,QA & Automation,Hybrid
System QA Automation Engineer בחברת Cyber,GotFriends,Tel Aviv,2026-05-10,https://www.gotfriends.co.il/jobslobby/qa/automation-developer/152844/,QA & Automation,Hybrid
Senior QA Automation בחברת מחקר מובילה בתחום ה-Cyber Security,GotFriends,Tel Aviv,2026-05-10,https://www.gotfriends.co.il/jobslobby/qa/automation-developer/152830/,QA & Automation,Hybrid
Senior QA Engineer בחברת סטארט-אפ בתחום ה-Data Intelligence,GotFriends,Tel Aviv,2026-05-10,https://www.gotfriends.co.il/jobslobby/qa/qa-positions/152822/,QA & Automation,Hybrid
Senior QA Engineer בחברת מחקר מובילה בתחום ה-Cyber Security,GotFriends,Tel Aviv,2026-05-10,https://www.gotfriends.co.il/jobslobby/qa/qa-positions/152748/,QA & Automation,Hybrid
Automation Lead בסטארט-אפ בתחום ה-Data Loss Prevention (DLP),GotFriends,Tel Aviv,2026-05-10,https://www.gotfriends.co.il/jobslobby/qa/head-of-qa-team/152735/,QA & Automation,onsite
AI System Testing בחברה מולטידיסיפלינארית,GotFriends,Tel Aviv,2026-05-10,https://www.gotfriends.co.il/jobslobby/qa/qa-positions/152714/,QA & Automation,onsite
QA Automation Tester בחברת הייטק העוסקת בסייבר התקפי,GotFriends,Tel Aviv,2026-05-10,https://www.gotfriends.co.il/jobslobby/qa/head-of-qa-team/152698/,QA & Automation,Hybrid
Senior Automation Engineer בחברת הייטק בתחום ה- Cyber,GotFriends,Tel Aviv,2026-05-10,https://www.gotfriends.co.il/jobslobby/qa/automation-developer/152679/,QA & Automation,Hybrid
QA Engineer בחברת סטארט-אפ בתחום ה-AI/VR,GotFriends,Tel Aviv,2026-05-10,https://www.gotfriends.co.il/jobslobby/qa/qa-positions/152578/,QA & Automation,Hybrid
Manual QA and Tech Support בחברת סטארט-אפ בתחום ה-Digital Health,GotFriends,Tel Aviv,2026-05-10,https://www.gotfriends.co.il/jobslobby/qa/qa-positions/152461/,QA & Automation,Hybrid
QA Automation Engineer בחברת סטארט-אפ בתחום ה-AI,GotFriends,Tel Aviv,2026-05-10,https://www.gotfriends.co.il/jobslobby/qa/automation-developer/152305/,QA & Automation,Hybrid
Senior System Integration Engineer בחברה בתחום התקשורת הדיגיטאלית,GotFriends,Tel Aviv,2026-05-10,https://www.gotfriends.co.il/jobslobby/qa/qa-positions/152277/,QA & Automation,Hybrid
Senior Python Automation Developer בחברת סטארט-אפ ביטחוני,GotFriends,Tel Aviv,2026-05-10,https://www.gotfriends.co.il/jobslobby/qa/automation-developer/152054/,QA & Automation,Hybrid
Automation Infrastructure and Testing Team Leader בחברת סטארט-אפ ביטחוני,GotFriends,Sharon,2026-05-10,https://www.gotfriends.co.il/jobslobby/qa/head-of-qa-team/152055/,QA & Automation,Hybrid
Senior QA Engineer בחברת סטארט-אפ בתחום ה-Security,GotFriends,Tel Aviv,2026-05-10,https://www.gotfriends.co.il/jobslobby/qa/automation-developer/151991/,QA & Automation,Hybrid
Automation Developer בחברה טכנולוגית,GotFriends,Tel Aviv,2026-05-10,https://www.gotfriends.co.il/jobslobby/qa/automation-developer/151854/,QA & Automation,Hybrid
Senior QA Automation בסטארט-אפ בתחום הבריאות הדיגיטלית- Bio-Tech,GotFriends,Tel Aviv,2026-05-10,https://www.gotfriends.co.il/jobslobby/qa/automation-developer/151694/,QA & Automation,Hybrid
Senior QA Engineer בחברת סטארט-אפ בתחום ה-Blockchain,GotFriends,Sharon,2026-05-10,https://www.gotfriends.co.il/jobslobby/qa/qa-positions/151586/,QA & Automation,Hybrid
Senior Automation Engineer בחברה פרטית,GotFriends,Tel Aviv,2026-05-10,https://www.gotfriends.co.il/jobslobby/qa/automation-developer/151587/,QA & Automation,Hybrid
QA Automation Team Lead בחברת הייטק העוסקת בסייבר התקפי,GotFriends,Tel Aviv,2026-05-10,https://www.gotfriends.co.il/jobslobby/qa/head-of-qa-team/151578/,QA & Automation,Hybrid
Senior QA Engineer בחברת Gaming,GotFriends,Tel Aviv,2026-05-10,https://www.gotfriends.co.il/jobslobby/qa/qa-positions/151392/,QA & Automation,Hybrid
System QA Engineer בחברת Cybersecurity,GotFriends,Tel Aviv,2026-05-10,https://www.gotfriends.co.il/jobslobby/qa/qa-positions/151316/,QA & Automation,Hybrid
Test Automation Engineer בחברת סטארט-אפ בתחום ה-Health Care,GotFriends,Tel Aviv,2026-05-10,https://www.gotfriends.co.il/jobslobby/qa/automation-developer/151318/,QA & Automation,Hybrid
Automation Infrastructure Engineer בחברת Cybersecurity,GotFriends,Tel Aviv,2026-05-10,https://www.gotfriends.co.il/jobslobby/qa/automation-developer/151301-1/,QA & Automation,Hybrid
Automation Infrastructure Engineer בחברת Cybersecurity,GotFriends,Tel Aviv,2026-05-10,https://www.gotfriends.co.il/jobslobby/qa/automation-developer/151301/,QA & Automation,Hybrid
Software QA Automation & Validation Engineer בחברת הייטק,GotFriends,Tel Aviv,2026-05-10,https://www.gotfriends.co.il/jobslobby/qa/automation-developer/151258/,QA & Automation,Hybrid
QA Engineer Senior בחברת Cyber הגנתי,GotFriends,Tel Aviv,2026-05-10,https://www.gotfriends.co.il/jobslobby/qa/qa-positions/151727/,QA & Automation,Hybrid
QA Automation Engineer בחברת סטארט-אפ בתחום ה-Digital Accessibility,GotFriends,Tel Aviv,2026-05-10,https://www.gotfriends.co.il/jobslobby/qa/automation-developer/151334/,QA & Automation,Hybrid
Automation Team Leader בחברת Cybersecurity,GotFriends,Tel Aviv,2026-05-10,https://www.gotfriends.co.il/jobslobby/qa/head-of-qa-team/151225/,QA & Automation,Hybrid
QA Engineer בחברת סטארט-אפ בתחום ה-AI,GotFriends,Tel Aviv,2026-05-10,https://www.gotfriends.co.il/jobslobby/qa/qa-positions/151196/,QA & Automation,Hybrid
QA Team Lead בחברת סטארט-אפ,GotFriends,Tel Aviv,2026-05-10,https://www.gotfriends.co.il/jobslobby/qa/qa-team-leader/151135/,QA & Automation,Hybrid
QA Team Leader בחברה בתחום טכנולוגיית החינוך,GotFriends,Tel Aviv,2026-05-10,https://www.gotfriends.co.il/jobslobby/qa/qa-team-leader/151117/,QA & Automation,Remote
Automation Team Leader בחברת סטארט-אפ,GotFriends,Tel Aviv,2026-05-10,https://www.gotfriends.co.il/jobslobby/qa/head-of-qa-team/151071/,QA & Automation,Hybrid
QA Team Leader בחברה בתחום התקשורת,GotFriends,Beer Sheva,2026-05-10,https://www.gotfriends.co.il/jobslobby/qa/qa-team-leader/151040/,QA & Automation,Hybrid
Senior QA Automation Engineer בחברה טכנולוגית המתמחה בניהול מידע בסביבת ענן היברידית,GotFriends,Tel Aviv,2026-05-10,https://www.gotfriends.co.il/jobslobby/qa/automation-developer/151032/,QA & Automation,Remote
QA Automation Engineer בחברת סטארט-אפ בתחום ה-Storage,GotFriends,Tel Aviv,2026-05-10,https://www.gotfriends.co.il/jobslobby/qa/automation-developer/150975/,QA & Automation,Hybrid
QA Automation Engineer בחברה פרטית מהתחום הביטחוני,GotFriends,Tel Aviv,2026-05-10,https://www.gotfriends.co.il/jobslobby/qa/automation-developer/150933/,QA & Automation,Hybrid
Senior QA Automation Engineer בחברת סטארט-אפ בתחום ה-Fintech,GotFriends,Tel Aviv,2026-05-10,https://www.gotfriends.co.il/jobslobby/qa/automation-developer/150896/,QA & Automation,Hybrid
Junior QA Engineer בחברת סטארט-אפ בתחום ה-Cyber Storage,GotFriends,Tel Aviv,2026-05-10,https://www.gotfriends.co.il/jobslobby/qa/qa-positions/150884/,QA & Automation,Hybrid
QA Engineer בחברת סטארט-אפ בתחום ה-Big Data,GotFriends,Tel Aviv,2026-05-10,https://www.gotfriends.co.il/jobslobby/qa/qa-positions/150935/,QA & Automation,Hybrid
QA Team Leader בחברה בתחום ה-AI Analytics,GotFriends,Tel Aviv,2026-05-10,https://www.gotfriends.co.il/jobslobby/qa/qa-team-leader/150634/,QA & Automation,Remote
QA Manual & Automation משולב React בחברת Fintech,GotFriends,Tel Aviv,2026-05-10,https://www.gotfriends.co.il/jobslobby/qa/automation-developer/150552/,QA & Automation,Hybrid
QA Engineer בחברת סטארט-אפ בתחום הרחפנים האוטונומיים,GotFriends,Shfela,2026-05-10,https://www.gotfriends.co.il/jobslobby/qa/qa-positions/150538/,QA & Automation,onsite
QA Automation Team Lead בחברת סטארט-אפ,GotFriends,Sharon,2026-05-10,https://www.gotfriends.co.il/jobslobby/qa/head-of-qa-team/150539/,QA & Automation,onsite
QA Automation Engineer בחברת סטארט-אפ,GotFriends,Sharon,2026-05-10,https://www.gotfriends.co.il/jobslobby/qa/automation-developer/150542/,QA & Automation,onsite
Manual QA Engineer,GotFriends,Tel Aviv,2026-05-10,https://www.gotfriends.co.il/jobslobby/qa/qa-positions/150863/,QA & Automation,Remote
Manual QA בחברת Gaming,GotFriends,Tel Aviv,2026-05-10,https://www.gotfriends.co.il/jobslobby/qa/qa-positions/150440/,QA & Automation,Hybrid
Automation Infrastructure Team Lead בחברת אינטרנט,GotFriends,Tel Aviv,2026-05-10,https://www.gotfriends.co.il/jobslobby/qa/head-of-qa-team/150325/,QA & Automation,Hybrid
Automation Engineer בחברת סטארט-אפ,GotFriends,Tel Aviv,2026-05-10,https://www.gotfriends.co.il/jobslobby/qa/automation-developer/150304/,QA & Automation,Hybrid
COST QA Team Leader בחברת סטארט-אפ בתחום ה-Cyber,GotFriends,Tel Aviv,2026-05-10,https://www.gotfriends.co.il/jobslobby/qa/qa-team-leader/150216/,QA & Automation,Hybrid
QA Engineer בחברת סטארט-אפ בתחום ה-AI,GotFriends,Tel Aviv,2026-05-10,https://www.gotfriends.co.il/jobslobby/qa/qa-positions/150183/,QA & Automation,Remote
Senior QA Automation Engineer בחברת סטארט-אפ בתחום ה-AI,GotFriends,Tel Aviv,2026-05-10,https://www.gotfriends.co.il/jobslobby/qa/automation-developer/150043/,QA & Automation,Hybrid
QA Engineer בחברת סטארט-אפ בתחום ה-AI,GotFriends,Tel Aviv,2026-05-10,https://www.gotfriends.co.il/jobslobby/qa/qa-positions/150008/,QA & Automation,Hybrid
QA Automation Engineer בחברת Fintech,GotFriends,Tel Aviv,2026-05-10,https://www.gotfriends.co.il/jobslobby/qa/automation-developer/149878/,QA & Automation,Hybrid
Senior QA Engineer בסטארט-אפ בתחום ה-Identity And Asset Management,GotFriends,Tel Aviv,2026-05-10,https://www.gotfriends.co.il/jobslobby/qa/qa-positions/149829/,QA & Automation,Hybrid
QA Automation Engineer בחברת סטארט-אפ בתחום ה-Cyber,GotFriends,Tel Aviv,2026-05-10,https://www.gotfriends.co.il/jobslobby/qa/automation-developer/149788/,QA & Automation,onsite
Automation Engineer בחברת סטארט-אפ בתחום השירות,GotFriends,Tel Aviv,2026-05-10,https://www.gotfriends.co.il/jobslobby/qa/automation-developer/149781/,QA & Automation,Hybrid
QA Automation Engineer בחברת Cybersecurity,GotFriends,Tel Aviv,2026-05-10,https://www.gotfriends.co.il/jobslobby/qa/automation-developer/149711/,QA & Automation,Hybrid
Senior QA Automation Engineer בחברת הייטק בתחום התוכנה,GotFriends,Tel Aviv,2026-05-10,https://www.gotfriends.co.il/jobslobby/qa/automation-developer/149669/,QA & Automation,Remote
QA Automation Engineer בחברת סטארט-אפ בתחום ה-Robotics,GotFriends,Tel Aviv,2026-05-10,https://www.gotfriends.co.il/jobslobby/qa/automation-developer/149652/,QA & Automation,onsite
QA Automation Lead בחברת סטארט-אפ,GotFriends,Tel Aviv,2026-05-10,https://www.gotfriends.co.il/jobslobby/qa/head-of-qa-team/149596/,QA & Automation,Hybrid
Senior QA Automation Engineer בחברת הייטק בתחום ה-IOT ו-AI,GotFriends,Haifa,2026-05-10,https://www.gotfriends.co.il/jobslobby/qa/qa-positions/149482/,QA & Automation,Hybrid
Automation Engineer בחברת Cyber,GotFriends,Tel Aviv,2026-05-10,https://www.gotfriends.co.il/jobslobby/qa/automation-developer/149425/,QA & Automation,Hybrid
Automation Developer בחברה אמריקאית גלובאלית,GotFriends,Tel Aviv,2026-05-10,https://www.gotfriends.co.il/jobslobby/qa/automation-developer/149354/,QA & Automation,Remote
Senior Automation Engineer בחברת Cyber הגנתי,GotFriends,Tel Aviv,2026-05-10,https://www.gotfriends.co.il/jobslobby/qa/automation-developer/149313/,QA & Automation,Hybrid
QA Engineer בחברת סטארט-אפ בתחום ה-Security,GotFriends,Tel Aviv,2026-05-10,https://www.gotfriends.co.il/jobslobby/qa/qa-positions/149283/,QA & Automation,Hybrid
Senior Testing Automation Engineer בחברת הייטק בתחום ה- Cyber,GotFriends,Tel Aviv,2026-05-10,https://www.gotfriends.co.il/jobslobby/qa/automation-developer/149250/,QA & Automation,Hybrid
Senior QA Engineer בחברת מחקר בתחום הסייבר ההתקפי,GotFriends,Tel Aviv,2026-05-10,https://www.gotfriends.co.il/jobslobby/qa/qa-positions/149247/,QA & Automation,Remote
QA Automation Engineer בחברת סטארט-אפ בתחום ה-Big Data,GotFriends,Tel Aviv,2026-05-10,https://www.gotfriends.co.il/jobslobby/qa/automation-developer/149139/,QA & Automation,Hybrid
Senior Automation Engineer בחברה טכנולוגית,GotFriends,Tel Aviv,2026-05-10,https://www.gotfriends.co.il/jobslobby/qa/automation-developer/149028/,QA & Automation,Hybrid
QA Automation בחברת סטארט-אפ,GotFriends,Tel Aviv,2026-05-10,https://www.gotfriends.co.il/jobslobby/qa/automation-developer/149024/,QA & Automation,onsite
Automation Team Lead בחברת הייטק בתחום ה- Cyber,GotFriends,Tel Aviv,2026-05-10,https://www.gotfriends.co.il/jobslobby/qa/head-of-qa-team/149255/,QA & Automation,Hybrid
Automation Team Lead בחברת סטארט-אפ בתחום הסייבר,GotFriends,Tel Aviv,2026-05-10,https://www.gotfriends.co.il/jobslobby/qa/head-of-qa-team/149395/,QA & Automation,Hybrid
QA Automation Engineer בחברת Sport-Tech,GotFriends,Tel Aviv,2026-05-10,https://www.gotfriends.co.il/jobslobby/qa/automation-developer/148959/,QA & Automation,Hybrid
QA Automation Engineer בחברה ישראלית שעוסקת במערכות לבקרת השקיה,GotFriends,Beer Sheva,2026-05-10,https://www.gotfriends.co.il/jobslobby/qa/automation-developer/148933/,QA & Automation,Hybrid
Manual QA בחברת סטארט-אפ בתחום ה-Digital Health,GotFriends,Tel Aviv,2026-05-10,https://www.gotfriends.co.il/jobslobby/qa/qa-positions/148896/,QA & Automation,onsite
Senior QA Engineer בחברת סטארט-אפ בתחום ה-Big Data,GotFriends,Tel Aviv,2026-05-10,https://www.gotfriends.co.il/jobslobby/qa/qa-positions/148826/,QA & Automation,Hybrid
Senior QA Engineer בחברת סטארט-אפ בתחום ה-Big Data,GotFriends,Tel Aviv,2026-05-10,https://www.gotfriends.co.il/jobslobby/qa/qa-positions/148824/,QA & Automation,Hybrid
Quality Assurance Test Engineer בחברת סטארט-אפ,GotFriends,Tel Aviv,2026-05-10,https://www.gotfriends.co.il/jobslobby/qa/automation-developer/148711/,QA & Automation,Hybrid
Frontend QA Automation Engineer בחברה בתעשיית ה-Fintech,GotFriends,Tel Aviv,2026-05-10,https://www.gotfriends.co.il/jobslobby/qa/automation-developer/148610/,QA & Automation,Hybrid
Software QA Engineer בחברת סטארט-אפ בתחום ה-AI,GotFriends,Tel Aviv,2026-05-10,https://www.gotfriends.co.il/jobslobby/qa/qa-positions/148571/,QA & Automation,Hybrid
QA Automation Engineer בחברת סטארט-אפ,GotFriends,Haifa,2026-05-10,https://www.gotfriends.co.il/jobslobby/qa/qa-positions/148362/,QA & Automation,Remote
QA Engineer and Architect בחברת סטארט-אפ בתחום הוירטואליזציה,GotFriends,Haifa,2026-05-10,https://www.gotfriends.co.il/jobslobby/qa/automation-developer/148997/,QA & Automation,Hybrid
QA Engineer בחברת הייטק בתחום שיפור איכות החשמל,GotFriends,Sharon,2026-05-10,https://www.gotfriends.co.il/jobslobby/qa/qa-positions/148953/,QA & Automation,onsite
QA Automation Engineer בחברת סטארט-אפ בתחום ה-Storage,GotFriends,Haifa,2026-05-10,https://www.gotfriends.co.il/jobslobby/qa/automation-developer/128176/,QA & Automation,Hybrid
QA Engineer בחברת תוכנה בעולם הפרסום הדיגיטלי,GotFriends,Haifa,2026-05-10,https://www.gotfriends.co.il/jobslobby/qa/qa-positions/149013/,QA & Automation,Hybrid
Software Development Engineer In Test בחברת סטארט-אפ בתחום ה-Digital Accessibility,GotFriends,Tel Aviv,2026-05-10,https://www.gotfriends.co.il/jobslobby/qa/automation-developer/148545/,QA & Automation,Hybrid
Automation Engineer בחברת Cyber,GotFriends,Tel Aviv,2026-05-10,https://www.gotfriends.co.il/jobslobby/qa/automation-developer/148511/,QA & Automation,Hybrid
QA Engineer בחברת סטארט-אפ בתחום הסייבר ההתקפי,GotFriends,Tel Aviv,2026-05-10,https://www.gotfriends.co.il/jobslobby/qa/qa-positions/148421/,QA & Automation,Hybrid
QA Automation Engineer בחברת סטארט-אפ בתחום ה-Automotive,GotFriends,Tel Aviv,2026-05-10,https://www.gotfriends.co.il/jobslobby/qa/automation-developer/148409/,QA & Automation,Remote
QA Automation בחברה בתחם הפינטק,GotFriends,Tel Aviv,2026-05-10,https://www.gotfriends.co.il/jobslobby/qa/automation-developer/148695/,QA & Automation,Remote
Automation Team Leader בחברת הייטק בתחום ה-Security,GotFriends,Tel Aviv,2026-05-10,https://www.gotfriends.co.il/jobslobby/qa/qa-team-leader/148223/,QA & Automation,Remote
QA Team Leader,GotFriends,Tel Aviv,2026-05-10,https://www.gotfriends.co.il/jobslobby/qa/qa-team-leader/148209/,QA & Automation,Hybrid
QA Automation Engineer בחברת סטארט-אפ בתחום ה-Fintech,GotFriends,Tel Aviv,2026-05-10,https://www.gotfriends.co.il/jobslobby/qa/automation-developer/148190/,QA & Automation,Hybrid
Automation Engineer Lead בחברה ישראלית,GotFriends,Tel Aviv,2026-05-10,https://www.gotfriends.co.il/jobslobby/qa/head-of-qa-team/148172/,QA & Automation,Hybrid
QA Engineer בחברת סטארט-אפ בתחום הסייבר לרכב,GotFriends,Tel Aviv,2026-05-10,https://www.gotfriends.co.il/jobslobby/qa/qa-positions/148164/,QA & Automation,Hybrid
Senior Automation Infrastructure Engineer בחברת סטארט-אפ בתחום ה-Storage,GotFriends,Tel Aviv,2026-05-10,https://www.gotfriends.co.il/jobslobby/qa/automation-developer/148022/,QA & Automation,Hybrid
QA Lead בחברת הייטק בתחום ה-IOT ו-AI,GotFriends,Tel Aviv,2026-05-10,https://www.gotfriends.co.il/jobslobby/qa/qa-team-leader/147936/,QA & Automation,Hybrid
QA Engineer חברת סטארטאפ ישראלית,GotFriends,Tel Aviv,2026-05-10,https://www.gotfriends.co.il/jobslobby/qa/qa-positions/147927/,QA & Automation,onsite
QA Engineer בחברת סטארט-אפ Auto-tech,GotFriends,Tel Aviv,2026-05-10,https://www.gotfriends.co.il/jobslobby/qa/qa-positions/147905/,QA & Automation,Remote
QA Team Leader בחברה פרטית,GotFriends,Tel Aviv,2026-05-10,https://www.gotfriends.co.il/jobslobby/qa/qa-team-leader/147776/,QA & Automation,Remote
QA Automation Team Lead בחברת סטארט-אפ בתחום ה-Fintech,GotFriends,Tel Aviv,2026-05-10,https://www.gotfriends.co.il/jobslobby/qa/qa-team-leader/147706/,QA & Automation,Remote
QA Engineer בחברת מחקר בתחום הסייבר ההתקפי,GotFriends,Tel Aviv,2026-05-10,https://www.gotfriends.co.il/jobslobby/qa/qa-positions/147633/,QA & Automation,Hybrid
QA Automation Engineer בחברה בתחום ה-Fintech,GotFriends,Tel Aviv,2026-05-10,https://www.gotfriends.co.il/jobslobby/qa/automation-developer/147553/,QA & Automation,Hybrid
Senior QA Automation Developer בחברת סטארט-אפ בתחום ה-Cyber Security,GotFriends,Tel Aviv,2026-05-10,https://www.gotfriends.co.il/jobslobby/qa/automation-developer/147550/,QA & Automation,Hybrid
QA Engineer בחברת סטארט-אפ בתחום הימאות,GotFriends,Tel Aviv,2026-05-10,https://www.gotfriends.co.il/jobslobby/qa/qa-positions/146707/,QA & Automation,Hybrid
System QA Engineer בחברת Cyber,GotFriends,Tel Aviv,2026-05-10,https://www.gotfriends.co.il/jobslobby/qa/qa-positions/147481/,QA & Automation,Hybrid
Senior QA Engineer בחברת סטארט-אפ בתחום ה-Cloud Data Security,GotFriends,Tel Aviv,2026-05-10,https://www.gotfriends.co.il/jobslobby/qa/qa-positions/147312/,QA & Automation,Hybrid
QA Engineer בחברה מולטידיספלינארית בתחום עיבוד תמונה ובינה מלאכותית,GotFriends,Tel Aviv,2026-05-10,https://www.gotfriends.co.il/jobslobby/qa/qa-positions/147297/,QA & Automation,Hybrid
Automation Engineer בחברת סטארט-אפ בתחום ה-Cyber,GotFriends,Tel Aviv,2026-05-10,https://www.gotfriends.co.il/jobslobby/qa/automation-developer/147280/,QA & Automation,Hybrid
Automation Engineer בחברת Fintech,GotFriends,Tel Aviv,2026-05-10,https://www.gotfriends.co.il/jobslobby/qa/automation-developer/147240/,QA & Automation,Hybrid
QA Manager בחברת סטארט-אפ בתחום ה-Autonomous Vehicle,GotFriends,Haifa,2026-05-10,https://www.gotfriends.co.il/jobslobby/qa/qa-positions/147230/,QA & Automation,Hybrid
QA Automation בחברת סטארט-אפ Stealth בתחום Generative AI,GotFriends,Tel Aviv,2026-05-10,https://www.gotfriends.co.il/jobslobby/qa/automation-developer/147182/,QA & Automation,Hybrid
AI Quantization Software Engineer בחברה טכנולוגית,GotFriends,Tel Aviv,2026-05-10,https://www.gotfriends.co.il/jobslobby/qa/qa-positions/147184/,QA & Automation,Hybrid
Lead Automation Engineer בחברת הייטק,GotFriends,Israel,2026-05-10,https://www.gotfriends.co.il/jobslobby/qa/head-of-qa-team/147141/,QA & Automation,Hybrid
Senior Automation QA Engineer בחברת Fintech,GotFriends,Tel Aviv,2026-05-10,https://www.gotfriends.co.il/jobslobby/qa/automation-developer/147138-1/,QA & Automation,Hybrid
Senior Automation QA Engineer בחברת Fintech,GotFriends,Tel Aviv,2026-05-10,https://www.gotfriends.co.il/jobslobby/qa/automation-developer/147138/,QA & Automation,Hybrid
Automation Developer בחברת סטארט-אפ בתחום הרחפנים האוטונומיים,GotFriends,Shfela,2026-05-10,https://www.gotfriends.co.il/jobslobby/qa/automation-developer/147088/,QA & Automation,Hybrid
Automation Engineer בתחום ה Big Data Location Analytics,GotFriends,Tel Aviv,2026-05-10,https://www.gotfriends.co.il/jobslobby/qa/automation-developer/147438/,QA & Automation,Remote
System Automation Validation Engineer בחברת סטארט-אפ בתחום ה-Data Analytics,GotFriends,Tel Aviv,2026-05-10,https://www.gotfriends.co.il/jobslobby/qa/automation-developer/147071/,QA & Automation,Hybrid
Automation Engineer בחברה מולטידיסיפלינארית,GotFriends,Sharon,2026-05-10,https://www.gotfriends.co.il/jobslobby/qa/automation-developer/146968/,QA & Automation,onsite
Experienced QA & Automation Engineer בחברת הייטק בתחום ה-Digital Experience Management,GotFriends,Tel Aviv,2026-05-10,https://www.gotfriends.co.il/jobslobby/qa/qa-positions/146955/,QA & Automation,Hybrid
System Validation & Automation Engineer  סטארט-אפ בתחום טכנולוגיית אבטחת Blockchain,GotFriends,Tel Aviv,2026-05-10,https://www.gotfriends.co.il/jobslobby/qa/automation-developer/146910/,QA & Automation,Hybrid
Senior Automation Engineer בחברת הייטק בינלאומית,GotFriends,Tel Aviv,2026-05-10,https://www.gotfriends.co.il/jobslobby/qa/automation-developer/147132/,QA & Automation,Remote
QA Automation Tech Lead בחברת סטארט-אפ בתחום ה-FinTech,GotFriends,Tel Aviv,2026-05-10,https://www.gotfriends.co.il/jobslobby/qa/head-of-qa-team/146892/,QA & Automation,Hybrid
QA Automation Engineer בחברת סטארט-אפ בתחום ה-Fintech,GotFriends,Tel Aviv,2026-05-10,https://www.gotfriends.co.il/jobslobby/qa/automation-developer/146879/,QA & Automation,Hybrid
Automation Engineer בסטארט-אפ בתחום ה-Identity And Asset Management,GotFriends,Tel Aviv,2026-05-10,https://www.gotfriends.co.il/jobslobby/qa/automation-developer/146881/,QA & Automation,Hybrid
QA Engineer בחברה טכנולוגית,GotFriends,Tel Aviv,2026-05-10,https://www.gotfriends.co.il/jobslobby/qa/qa-positions/146896/,QA & Automation,Remote
QA Engineer בחברה בתחום ה-SaaS Car Mobility,GotFriends,Tel Aviv,2026-05-10,https://www.gotfriends.co.il/jobslobby/qa/qa-positions/146858/,QA & Automation,Hybrid
