title,company,location,date,url,department,workplace_type
Principle Product Manager בחברת Cyber Security,GotFriends,Tel Aviv,2026-05-10,https://www.gotfriends.co.il/jobslobby/projects/product-manager/151299/,Product Management,Hybrid
Product Manager בחברת הייטק בתחום ניהול Identities,GotFriends,Tel Aviv,2026-05-10,https://www.gotfriends.co.il/jobslobby/projects/product-manager/151219/,Product Management,Hybrid
Senior Product Manager בחברת הייטק,GotFriends,Tel Aviv,2026-05-10,https://www.gotfriends.co.il/jobslobby/projects/product-manager/150987/,Product Management,Hybrid
Product Manager בחברה אמריקאית,GotFriends,Tel Aviv,2026-05-10,https://www.gotfriends.co.il/jobslobby/projects/product-manager/150954/,Product Management,Hybrid
Senior Product Manager- בחברת הייטק בתחום ה-DevSecOps ו-MLOps,GotFriends,Sharon,2026-05-10,https://www.gotfriends.co.il/jobslobby/projects/product-manager/151126/,Product Management,Hybrid
Senior Product Manager בחברת סטארט-אפ,GotFriends,Tel Aviv,2026-05-10,https://www.gotfriends.co.il/jobslobby/projects/product-manager/150370/,Product Management,onsite
Technical Product Manager בחברת סטארט-אפ בתחום ה-Ad-Tech,GotFriends,Tel Aviv,2026-05-10,https://www.gotfriends.co.il/jobslobby/projects/product-manager/151213/,Product Management,Hybrid
Product Manager- Social Casino (B2C Web Application) בחברת Bootstrap,GotFriends,Tel Aviv,2026-05-10,https://www.gotfriends.co.il/jobslobby/projects/product-manager/150949/,Product Management,Hybrid
Director of Product Management בחברת הייטק בתחום ה-Cyber,GotFriends,Shfela,2026-05-10,https://www.gotfriends.co.il/jobslobby/projects/vp-product/150774/,Product Management,Hybrid
Senior Product Manager בחברת הייטק בינלאומית,GotFriends,Tel Aviv,2026-05-10,https://www.gotfriends.co.il/jobslobby/projects/product-manager/150714/,Product Management,Remote
Senior Product Manager בחברת סטארט-אפ מולטי הדיסציפלינרית בתחום Retail-Tech ו-Computer Vision,GotFriends,Tel Aviv,2026-05-10,https://www.gotfriends.co.il/jobslobby/projects/product-manager/151065/,Product Management,Hybrid
Senior Product Manager בחברת סטארט-אפ בתחום האבטחה ל-AI,GotFriends,Tel Aviv,2026-05-10,https://www.gotfriends.co.il/jobslobby/projects/product-manager/150141/,Product Management,onsite
ניהול מוצר B2B בחברת סטארט-אפ העוסקת בעולמות של Data,GotFriends,Tel Aviv,2026-05-10,https://www.gotfriends.co.il/jobslobby/projects/product-manager/151104/,Product Management,Hybrid
Senior Product Manager בחברת סטארט-אפ בתחום ה- Web3 Security,GotFriends,Tel Aviv,2026-05-10,https://www.gotfriends.co.il/jobslobby/projects/product-manager/151002-1/,Product Management,onsite
Senior Product Manager בחברת סטארט-אפ בתחום ה- Web3 Security,GotFriends,Tel Aviv,2026-05-10,https://www.gotfriends.co.il/jobslobby/projects/product-manager/151002/,Product Management,onsite
Senior Product Manager בחברת מחקר בוטיקית בשוק הסייבר ההתקפי,GotFriends,Tel Aviv,2026-05-10,https://www.gotfriends.co.il/jobslobby/projects/product-manager/151136/,Product Management,Hybrid
Product Manager בחברת סטארט-אפ,GotFriends,Tel Aviv,2026-05-10,https://www.gotfriends.co.il/jobslobby/projects/product-manager/146725/,Product Management,Hybrid
Product Manager בחברת הייטק בתחום ה-Security,GotFriends,Tel Aviv,2026-05-10,https://www.gotfriends.co.il/jobslobby/projects/product-manager/151143/,Product Management,Hybrid
Senior Product Manager בחברת Fintech,GotFriends,Tel Aviv,2026-05-10,https://www.gotfriends.co.il/jobslobby/projects/product-manager/150723/,Product Management,Remote
משרת ניהול מוצר B2B בחברת Insure Tech,GotFriends,Tel Aviv,2026-05-10,https://www.gotfriends.co.il/jobslobby/projects/product-manager/150666/,Product Management,Hybrid
Product Manager בחברת סטארט-אפ בתחום ה-Data Loss Prevention,GotFriends,Tel Aviv,2026-05-10,https://www.gotfriends.co.il/jobslobby/projects/product-manager/150614/,Product Management,Hybrid
Senior Product Manager- Mobile בחברת אינטרנט,GotFriends,Tel Aviv,2026-05-10,https://www.gotfriends.co.il/jobslobby/projects/product-manager/150600/,Product Management,Hybrid
Senior Product Manager בחברת סטארט-אפ בעולמות ה-Security,GotFriends,Tel Aviv,2026-05-10,https://www.gotfriends.co.il/jobslobby/projects/product-manager/150872/,Product Management,Hybrid
Product Manager בחברת סטארט-אפ בתחום הסייבר ההגנתי,GotFriends,Tel Aviv,2026-05-10,https://www.gotfriends.co.il/jobslobby/projects/product-manager/150536/,Product Management,Hybrid
Product Manager בחברת Cyber Security,GotFriends,Tel Aviv,2026-05-10,https://www.gotfriends.co.il/jobslobby/projects/product-manager/150506/,Product Management,Hybrid
Technical Product Owner בחברת סטארט-אפ בתחום ה-Fintech,GotFriends,Tel Aviv,2026-05-10,https://www.gotfriends.co.il/jobslobby/projects/product-manager/150504/,Product Management,Hybrid
Senior Data Product Manager בחברת Fintech,GotFriends,Tel Aviv,2026-05-10,https://www.gotfriends.co.il/jobslobby/projects/product-manager/150501/,Product Management,Remote
Senior Product Manager בחברת סטארט-אפ בתחום ה-eCommerce,GotFriends,Tel Aviv,2026-05-10,https://www.gotfriends.co.il/jobslobby/projects/product-manager/150326/,Product Management,Remote
Senior Product Manager בחברת סטארט-אפ,GotFriends,Tel Aviv,2026-05-10,https://www.gotfriends.co.il/jobslobby/projects/product-manager/150221/,Product Management,Hybrid
Product Manager בחברת סטארט-אפ בתחום ה-Fintech,GotFriends,Tel Aviv,2026-05-10,https://www.gotfriends.co.il/jobslobby/projects/product-manager/150212/,Product Management,Hybrid
Director of Product בחברה בתחום ה-Online Gaming,GotFriends,Tel Aviv,2026-05-10,https://www.gotfriends.co.il/jobslobby/projects/vp-product/150207/,Product Management,Hybrid
Product Manager בחברת סטארט-אפ בתחום ה-Security Operation,GotFriends,Tel Aviv,2026-05-10,https://www.gotfriends.co.il/jobslobby/projects/product-manager/150100/,Product Management,Hybrid
Product Manager- Network בחברת Cyber,GotFriends,Tel Aviv,2026-05-10,https://www.gotfriends.co.il/jobslobby/projects/product-manager/150075/,Product Management,Hybrid
Senior Product Manager בחברת אינטרנט,GotFriends,Tel Aviv,2026-05-10,https://www.gotfriends.co.il/jobslobby/projects/product-manager/150067/,Product Management,Hybrid
Product Manager בחברת סטארט-אפ בתחום ה-Medical,GotFriends,Tel Aviv,2026-05-10,https://www.gotfriends.co.il/jobslobby/projects/product-manager/150013/,Product Management,onsite
Product Manager בחברת הייטק בתחום ה-IOT ו-AI,GotFriends,Tel Aviv,2026-05-10,https://www.gotfriends.co.il/jobslobby/projects/product-manager/149970/,Product Management,Hybrid
Head Of Product בחברה בתחום ה-Fintech ו-Legal Tech,GotFriends,Tel Aviv,2026-05-10,https://www.gotfriends.co.il/jobslobby/projects/vp-product/149896/,Product Management,Hybrid
Director Product Manager- בחברת אבטחת המידע,GotFriends,Tel Aviv,2026-05-10,https://www.gotfriends.co.il/jobslobby/projects/vp-product/149905/,Product Management,Hybrid
Product Manager בחברת סטארט-אפ בתחום ה-Security,GotFriends,Tel Aviv,2026-05-10,https://www.gotfriends.co.il/jobslobby/projects/product-manager/149888/,Product Management,Hybrid
Director Product Manager- AppSec בחברת אבטחת המידע,GotFriends,Tel Aviv,2026-05-10,https://www.gotfriends.co.il/jobslobby/projects/vp-product/149890/,Product Management,Hybrid
Senior Product Manager בחברת סטארט-אפ בתחום הבריאות,GotFriends,Tel Aviv,2026-05-10,https://www.gotfriends.co.il/jobslobby/projects/product-manager/149812/,Product Management,Hybrid
Product Manager בסטארט-אפ בתחום ה-AI,GotFriends,Tel Aviv,2026-05-10,https://www.gotfriends.co.il/jobslobby/projects/product-manager/149753/,Product Management,Hybrid
Product Manager בחברת סטארט-אפ בתחום ה-AI,GotFriends,Tel Aviv,2026-05-10,https://www.gotfriends.co.il/jobslobby/projects/product-manager/149661/,Product Management,onsite
Product Manager בחברת סטארט-אפ בתחום ה-Fintech,GotFriends,Tel Aviv,2026-05-10,https://www.gotfriends.co.il/jobslobby/projects/product-manager/149651/,Product Management,Hybrid
Senior Product Manager בחברת אבטחת מידע,GotFriends,Tel Aviv,2026-05-10,https://www.gotfriends.co.il/jobslobby/projects/product-manager/149614/,Product Management,Hybrid
Senior Product Manager- Platform Services בחברת הייטק בתחום ה-DevOps,GotFriends,Tel Aviv,2026-05-10,https://www.gotfriends.co.il/jobslobby/projects/product-manager/149552/,Product Management,Hybrid
Senior Product Manager בחברת E Learning,GotFriends,Tel Aviv,2026-05-10,https://www.gotfriends.co.il/jobslobby/projects/product-manager/149536/,Product Management,Remote
Director of Product Management- Platform Engineering בחברת הייטק בתחום ה-DevOps,GotFriends,Tel Aviv,2026-05-10,https://www.gotfriends.co.il/jobslobby/projects/product-manager/149497/,Product Management,Hybrid
Director of Product Management- Platform Engineering בחברת הייטק בתחום ה-DevOps,GotFriends,Tel Aviv,2026-05-10,https://www.gotfriends.co.il/jobslobby/projects/vp-product/149497/,Product Management,Hybrid
Product Director בחברת סטארט-אפ בתחום ה-Cyber וה-Secure & Insure,GotFriends,Tel Aviv,2026-05-10,https://www.gotfriends.co.il/jobslobby/projects/vp-product/149471/,Product Management,Hybrid
Product Manager בחברת סארט-אפ,GotFriends,Sharon,2026-05-10,https://www.gotfriends.co.il/jobslobby/projects/product-manager/149358/,Product Management,Remote
Senior Product Manager בחברה הייטק בינלאומית,GotFriends,Tel Aviv,2026-05-10,https://www.gotfriends.co.il/jobslobby/projects/product-manager/149347/,Product Management,Hybrid
Senior Product Manager בחברת סטארט-אפ בתחום ה-AI,GotFriends,Tel Aviv,2026-05-10,https://www.gotfriends.co.il/jobslobby/projects/product-manager/149321/,Product Management,Hybrid
Senior Data Product Manager בחברה טכנולוגית,GotFriends,Shfela,2026-05-10,https://www.gotfriends.co.il/jobslobby/projects/product-manager/149718/,Product Management,Remote
Product Manager בחברת סטארט-אפ בתחום ה-Cyber Storage,GotFriends,Tel Aviv,2026-05-10,https://www.gotfriends.co.il/jobslobby/projects/product-manager/149216/,Product Management,Hybrid
Director of Product Management בחברת סטארט-אפ,GotFriends,Sharon,2026-05-10,https://www.gotfriends.co.il/jobslobby/projects/vp-product/149149/,Product Management,Hybrid
Senior Product Manager בסטארט-אפ בתחום ה-SaaS Security,GotFriends,Tel Aviv,2026-05-10,https://www.gotfriends.co.il/jobslobby/projects/product-manager/149089-1/,Product Management,Hybrid
Senior Product Manager בסטארט-אפ בתחום ה-SaaS Security,GotFriends,Tel Aviv,2026-05-10,https://www.gotfriends.co.il/jobslobby/projects/product-manager/149089/,Product Management,Hybrid
Senior Product Manager חברת הייטק מונפקת,GotFriends,Tel Aviv,2026-05-10,https://www.gotfriends.co.il/jobslobby/projects/product-manager/148233-1/,Product Management,Remote
Senior Product Manager חברת הייטק מונפקת,GotFriends,Tel Aviv,2026-05-10,https://www.gotfriends.co.il/jobslobby/projects/product-manager/148233/,Product Management,Remote
Product Manager בחברת סטארט-אפ בתחום ה-Software Supply Chain,GotFriends,Tel Aviv,2026-05-10,https://www.gotfriends.co.il/jobslobby/projects/product-manager/149311/,Product Management,Hybrid
Technical Product Manager בחברה בתחום ה-OTT,GotFriends,Tel Aviv,2026-05-10,https://www.gotfriends.co.il/jobslobby/projects/product-manager/149164/,Product Management,Hybrid
Cloud Product Manager בחברת סטארט-אפ בתחום הסייבר,GotFriends,Tel Aviv,2026-05-10,https://www.gotfriends.co.il/jobslobby/projects/product-manager/148986/,Product Management,Remote
"Team Lead, Product Management בחברת הייטק",GotFriends,Tel Aviv,2026-05-10,https://www.gotfriends.co.il/jobslobby/projects/product-manager/149370/,Product Management,Remote
Head of Product בחברה בתחום ה-OTT,GotFriends,Tel Aviv,2026-05-10,https://www.gotfriends.co.il/jobslobby/projects/vp-product/148908/,Product Management,Hybrid
Director Product Manager B2B2C בחברה טכנולוגית,GotFriends,Tel Aviv,2026-05-10,https://www.gotfriends.co.il/jobslobby/projects/vp-product/148905/,Product Management,Hybrid
Senior Product Manager בחברת סטארט-אפ,GotFriends,Tel Aviv,2026-05-10,https://www.gotfriends.co.il/jobslobby/projects/product-manager/148901/,Product Management,Hybrid
Algo Product Manager בחברת סטארט-אפ בתחום של תחבורה,GotFriends,Tel Aviv,2026-05-10,https://www.gotfriends.co.il/jobslobby/projects/product-manager/149351/,Product Management,Hybrid
ניהול מוצר בחברת סטארט-אפ בתחום של הגנת תשתיות ענן בזמן אמת,GotFriends,Tel Aviv,2026-05-10,https://www.gotfriends.co.il/jobslobby/projects/product-manager/148819/,Product Management,Hybrid
Senior Product Manager בחברה בתחום ה-Online Gaming,GotFriends,Tel Aviv,2026-05-10,https://www.gotfriends.co.il/jobslobby/projects/product-manager/148804/,Product Management,Hybrid
Product Manager בחברת Consumer-Tech,GotFriends,Tel Aviv,2026-05-10,https://www.gotfriends.co.il/jobslobby/projects/product-manager/148766/,Product Management,Hybrid
Senior Product Manager בחברת סטארט-אפ סייבר,GotFriends,Tel Aviv,2026-05-10,https://www.gotfriends.co.il/jobslobby/projects/product-manager/148744/,Product Management,Hybrid
Senior Product Manager בחברת סטארט-אפ בתחום הרחפנים האוטונומיים,GotFriends,Tel Aviv,2026-05-10,https://www.gotfriends.co.il/jobslobby/projects/product-manager/148719/,Product Management,Hybrid
Technical Product Manager בחברה טכנולוגית,GotFriends,Tel Aviv,2026-05-10,https://www.gotfriends.co.il/jobslobby/projects/product-manager/148687/,Product Management,Hybrid
Product Manager בחברה בתחום ה-SaaS Car Mobility,GotFriends,Tel Aviv,2026-05-10,https://www.gotfriends.co.il/jobslobby/projects/product-manager/148642-1/,Product Management,Hybrid
Product Manager בחברה בתחום ה-SaaS Car Mobility,GotFriends,Sharon,2026-05-10,https://www.gotfriends.co.il/jobslobby/projects/product-manager/148642/,Product Management,Hybrid
Senior Product Manager בסטארט-אפ בתחום ה-Trust & Safety,GotFriends,Tel Aviv,2026-05-10,https://www.gotfriends.co.il/jobslobby/projects/product-manager/148641/,Product Management,Remote
Director of Cloud Product Management בחברה בתחום ה-Cyber Security וה-Big Data,GotFriends,Tel Aviv,2026-05-10,https://www.gotfriends.co.il/jobslobby/projects/vp-product/148629/,Product Management,Hybrid
Product Manager בחברת סטארט-אפ בתחום ה- Gaming,GotFriends,Tel Aviv,2026-05-10,https://www.gotfriends.co.il/jobslobby/projects/product-manager/148557/,Product Management,Hybrid
Senior Software Product Management אפליקטיבית בחברה בתחום ה-Automotive,GotFriends,Tel Aviv,2026-05-10,https://www.gotfriends.co.il/jobslobby/projects/product-manager/148546/,Product Management,Hybrid
Product Manager בחברת סטארט-אפ בתחום ה-Security וה-Crypto,GotFriends,Tel Aviv,2026-05-10,https://www.gotfriends.co.il/jobslobby/projects/product-manager/148501/,Product Management,Remote
Senior Product Management בחברה טכנולוגית,GotFriends,Tel Aviv,2026-05-10,https://www.gotfriends.co.il/jobslobby/projects/product-manager/148505/,Product Management,Hybrid
Product Manager בחברת הייטק,GotFriends,Tel Aviv,2026-05-10,https://www.gotfriends.co.il/jobslobby/projects/product-manager/148493/,Product Management,Hybrid
VP of Product Management בחברת הייטק בתחום התקשורת,GotFriends,Tel Aviv,2026-05-10,https://www.gotfriends.co.il/jobslobby/projects/vp-product/148497/,Product Management,Hybrid
Monetization Product Manager בחברת הייטק,GotFriends,Tel Aviv,2026-05-10,https://www.gotfriends.co.il/jobslobby/projects/product-manager/148485/,Product Management,Hybrid
Product Manager בחברת סטארט-אפ בתחום ה-AI,GotFriends,Tel Aviv,2026-05-10,https://www.gotfriends.co.il/jobslobby/projects/product-manager/148470/,Product Management,Hybrid
Senior Product Manager בחברת הייטק,GotFriends,Tel Aviv,2026-05-10,https://www.gotfriends.co.il/jobslobby/projects/product-manager/148463-1/,Product Management,Remote
Senior Product Manager בחברת הייטק,GotFriends,Tel Aviv,2026-05-10,https://www.gotfriends.co.il/jobslobby/projects/product-manager/148463/,Product Management,Remote
Head of Product בחברת הייטק,GotFriends,Tel Aviv,2026-05-10,https://www.gotfriends.co.il/jobslobby/projects/product-manager/148449/,Product Management,Hybrid
Product Manager בחברת Fintech,GotFriends,Tel Aviv,2026-05-10,https://www.gotfriends.co.il/jobslobby/projects/product-manager/148437/,Product Management,Hybrid
Senior Product Manager בסטארט-אפ בתחום ה- security,GotFriends,Tel Aviv,2026-05-10,https://www.gotfriends.co.il/jobslobby/projects/product-manager/148861/,Product Management,onsite
Senior Product Manager בסטארט-אפ בתחום ה-Cyber בתחום ה-Identity Management,GotFriends,Tel Aviv,2026-05-10,https://www.gotfriends.co.il/jobslobby/projects/product-manager/148402/,Product Management,Hybrid
Product Manager בחברת סטארט-אפ בתחום ה-Ecommerce,GotFriends,Tel Aviv,2026-05-10,https://www.gotfriends.co.il/jobslobby/projects/product-manager/148381/,Product Management,Hybrid
Senior Product Manager בחברת Fintech,GotFriends,Tel Aviv,2026-05-10,https://www.gotfriends.co.il/jobslobby/projects/product-manager/148349/,Product Management,Hybrid
Product Manager בחברת סטארט-אפ,GotFriends,Tel Aviv,2026-05-10,https://www.gotfriends.co.il/jobslobby/projects/product-manager/148326/,Product Management,Remote
Director of Product Management בחברת סטארט-אפ בתחום ה-AI,GotFriends,Tel Aviv,2026-05-10,https://www.gotfriends.co.il/jobslobby/projects/product-manager/148179/,Product Management,Hybrid
Product Manager בחברת סטרטאפ בתחום ה-AI.,GotFriends,Tel Aviv,2026-05-10,https://www.gotfriends.co.il/jobslobby/projects/product-manager/148612/,Product Management,Remote
Technical Product Manager בחברת סטארט-אפ בתחום ה-Gaming,GotFriends,Tel Aviv,2026-05-10,https://www.gotfriends.co.il/jobslobby/projects/product-manager/148089/,Product Management,Hybrid
Senior Product Manager בחברת סטארט-אפ,GotFriends,Tel Aviv,2026-05-10,https://www.gotfriends.co.il/jobslobby/projects/product-manager/148030/,Product Management,Hybrid
Senior Product Manager B2C בחברה הייטק,GotFriends,Tel Aviv,2026-05-10,https://www.gotfriends.co.il/jobslobby/projects/product-manager/148009/,Product Management,Hybrid
Product Manager בחברת סטארט-אפ בתחום ה-Fintech,GotFriends,Tel Aviv,2026-05-10,https://www.gotfriends.co.il/jobslobby/projects/product-manager/147938/,Product Management,Hybrid
VP Product בחברת סטארט-אפ,GotFriends,Tel Aviv,2026-05-10,https://www.gotfriends.co.il/jobslobby/projects/vp-product/147940/,Product Management,Hybrid
VP of Product Management בחברת סטארט-אפ Auto-tech,GotFriends,Tel Aviv,2026-05-10,https://www.gotfriends.co.il/jobslobby/projects/vp-product/147904/,Product Management,Remote
Head Of Product בחברת סטארט-אפ בתחום ה-Gaming,GotFriends,Sharon,2026-05-10,https://www.gotfriends.co.il/jobslobby/projects/vp-product/147838/,Product Management,Hybrid
Outbound Product Manager בחברת סטארט-אפ בתחום ה-AI,GotFriends,Tel Aviv,2026-05-10,https://www.gotfriends.co.il/jobslobby/projects/product-manager/147834/,Product Management,Remote
Product Group Lead בחברת סטארט-אפ,GotFriends,Tel Aviv,2026-05-10,https://www.gotfriends.co.il/jobslobby/projects/vp-product/147743/,Product Management,Hybrid
Technical Product Manager בחברת יוניקורן,GotFriends,Tel Aviv,2026-05-10,https://www.gotfriends.co.il/jobslobby/projects/product-manager/147728/,Product Management,Hybrid
Senior Product Manager בחברת סטארט-אפ בתחום ה-Big Data,GotFriends,Tel Aviv,2026-05-10,https://www.gotfriends.co.il/jobslobby/projects/product-manager/147685/,Product Management,Hybrid
Senior Product Manager בחברת סייבר,GotFriends,Tel Aviv,2026-05-10,https://www.gotfriends.co.il/jobslobby/projects/product-manager/147595/,Product Management,Hybrid
VP Product Payments בחברה בתחום ה-OTT,GotFriends,Tel Aviv,2026-05-10,https://www.gotfriends.co.il/jobslobby/projects/product-manager/147583/,Product Management,Hybrid
Lead Product Manager בחברת הייטק בתחום ה-Security,GotFriends,Tel Aviv,2026-05-10,https://www.gotfriends.co.il/jobslobby/projects/product-manager/147569/,Product Management,onsite
Senior Product Manager בחברת סטארט-אפ בתחום ה-Cyber,GotFriends,Tel Aviv,2026-05-10,https://www.gotfriends.co.il/jobslobby/projects/product-manager/147800/,Product Management,Hybrid
Senior Product Manager בחברת Cyber Security,GotFriends,Tel Aviv,2026-05-10,https://www.gotfriends.co.il/jobslobby/projects/product-manager/146303/,Product Management,Hybrid
Head of Product בחברת סטארט-אפ,GotFriends,Tel Aviv,2026-05-10,https://www.gotfriends.co.il/jobslobby/projects/product-manager/147490/,Product Management,onsite
Senior Product Manager בחברת Cyber Security,GotFriends,Tel Aviv,2026-05-10,https://www.gotfriends.co.il/jobslobby/projects/product-manager/147391/,Product Management,Hybrid
Product Manager בחברת סטארט-אפ בתחום ה-Fintech,GotFriends,Tel Aviv,2026-05-10,https://www.gotfriends.co.il/jobslobby/projects/product-manager/147367/,Product Management,Hybrid
Product Manager בחברת סטארט-אפ בתחום ה-Cyber Storage,GotFriends,Tel Aviv,2026-05-10,https://www.gotfriends.co.il/jobslobby/projects/product-manager/147363/,Product Management,Hybrid
Product Manager בחברת סטארט-אפ,GotFriends,Tel Aviv,2026-05-10,https://www.gotfriends.co.il/jobslobby/projects/product-manager/147298/,Product Management,Hybrid
"Product Manager, בחברת הייטק",GotFriends,Tel Aviv,2026-05-10,https://www.gotfriends.co.il/jobslobby/projects/product-manager/147295/,Product Management,Hybrid
Senior Product Manager בחברת סטארט-אפ בתחום Insurtech,GotFriends,Tel Aviv,2026-05-10,https://www.gotfriends.co.il/jobslobby/projects/product-manager/147256/,Product Management,Hybrid
Product Manager בחברת הייטק בתחום ה-Fintech,GotFriends,Tel Aviv,2026-05-10,https://www.gotfriends.co.il/jobslobby/projects/product-manager/147234/,Product Management,Hybrid
"Product Manager, Fintech בחברת הייטק",GotFriends,Tel Aviv,2026-05-10,https://www.gotfriends.co.il/jobslobby/projects/product-manager/147219-1/,Product Management,Hybrid
"Product Manager, Fintech בחברת הייטק",GotFriends,Tel Aviv,2026-05-10,https://www.gotfriends.co.il/jobslobby/projects/product-manager/147219/,Product Management,Hybrid
Product Manager בחברה בתחום ה-Cyber ההגנתי,GotFriends,Tel Aviv,2026-05-10,https://www.gotfriends.co.il/jobslobby/projects/product-manager/147190/,Product Management,Hybrid
Senior Product Manager בחברת סטארט-אפ בתחום ה-Cyber Security,GotFriends,Tel Aviv,2026-05-10,https://www.gotfriends.co.il/jobslobby/projects/product-manager/147196/,Product Management,Hybrid
Senior Product Manager בחברת אינטרנט,GotFriends,Tel Aviv,2026-05-10,https://www.gotfriends.co.il/jobslobby/projects/product-manager/147145/,Product Management,Hybrid
Product Manager בחברה בתחום ה-Fintech,GotFriends,Tel Aviv,2026-05-10,https://www.gotfriends.co.il/jobslobby/projects/product-manager/147081/,Product Management,Hybrid
Product Manager בחברה בתחום ה-OTT,GotFriends,Tel Aviv,2026-05-10,https://www.gotfriends.co.il/jobslobby/projects/product-manager/147053/,Product Management,Hybrid
Product Manager בחברת סטארט-אפ בתחום ה-Cyber,GotFriends,Tel Aviv,2026-05-10,https://www.gotfriends.co.il/jobslobby/projects/product-manager/147017/,Product Management,Hybrid
Senior Product Manager בחברת סטארט-אפ בתחום ה-Security,GotFriends,Tel Aviv,2026-05-10,https://www.gotfriends.co.il/jobslobby/projects/product-manager/147011/,Product Management,Hybrid
Product Manager  בתחום ה-Cyber Security,GotFriends,Tel Aviv,2026-05-10,https://www.gotfriends.co.il/jobslobby/projects/product-manager/147030/,Product Management,Hybrid
Product Manager בחברת סטארט-אפ בתחום ה-SaaS ו-Online,GotFriends,Tel Aviv,2026-05-10,https://www.gotfriends.co.il/jobslobby/projects/product-manager/147001/,Product Management,Hybrid
Senior DevOps Engineer בחברת סטארט-אפ Security בתחום אבטחת הסייבר בענן,GotFriends,Tel Aviv,2026-05-10,https://www.gotfriends.co.il/jobslobby/system/devops-positions/153689/,DevOps & System,onsite
DevOps Team Lead בחברת סייבר אסטרטגית ורווחית,GotFriends,Tel Aviv,2026-05-10,https://www.gotfriends.co.il/jobslobby/system/head-of-devops-team/153699/,DevOps & System,Hybrid
