title,company,location,date,url,department,workplace_type
Software team lead בחברת סטארט-אפ בתחום Cybersecurity for AI Agents ו-LLM Systems,GotFriends,Tel Aviv,2026-05-10,https://www.gotfriends.co.il/jobslobby/software/head-of-development-team/153727/,Software Development,Hybrid
Software Platform Engineer Team Lead בחברת סטארט-אפ ב-Stealth,GotFriends,Tel Aviv,2026-05-10,https://www.gotfriends.co.il/jobslobby/software/head-of-development-team/153720/,Software Development,Hybrid
Senior Full-Stack Engineer בחברת סטארט-אפ בתחום Sales intelligence,GotFriends,Tel Aviv,2026-05-10,https://www.gotfriends.co.il/jobslobby/software/full-stack-developer/153751/,Software Development,onsite
Backend Software Engineer בחברת סטארט-אפ בתחום ה-Storage,GotFriends,Tel Aviv,2026-05-10,https://www.gotfriends.co.il/jobslobby/software/backend-developer/153743/,Software Development,Hybrid
Senior Backend Software Engineer בחברת סטארט-אפ פורצת דרך,GotFriends,Tel Aviv,2026-05-10,https://www.gotfriends.co.il/jobslobby/software/backend-developer/153747/,Software Development,Hybrid
Senior Backend Developer בחברת סטארט-אפ העוסקת בתחום הפרסום,GotFriends,Tel Aviv,2026-05-10,https://www.gotfriends.co.il/jobslobby/software/backend-developer/153733/,Software Development,Hybrid
Senior Full Stack Engineer בחברת סטארט-אפ ישראלית,GotFriends,Tel Aviv,2026-05-10,https://www.gotfriends.co.il/jobslobby/software/full-stack-developer/153749/,Software Development,Hybrid
Senior BI Data Engineer בחברת סטארט-אפ בתחום ה-Data,GotFriends,Tel Aviv,2026-05-10,https://www.gotfriends.co.il/jobslobby/software/data-engineer/153744/,Software Development,Hybrid
Frontend developer בחברה גלובלית בתחום ה-AI,GotFriends,Tel Aviv,2026-05-10,https://www.gotfriends.co.il/jobslobby/software/frontend-developer/153974/,Software Development,Remote
Mid Backend Engineer בחברת סטארט-אפ בתחום Construction Tech,GotFriends,Tel Aviv,2026-05-10,https://www.gotfriends.co.il/jobslobby/software/backend-developer/153220/,Software Development,Remote
Senior Frontend Engineer-Core Team בחברת סטארט-אפ בתחום ה-AI,GotFriends,Tel Aviv,2026-05-10,https://www.gotfriends.co.il/jobslobby/software/frontend-developer/153731/,Software Development,Hybrid
Software Team Lead בחברת סטארט-אפ בתחום Cybersecurity for AI Agents ו-LLM Systems,GotFriends,Tel Aviv,2026-05-10,https://www.gotfriends.co.il/jobslobby/software/head-of-development-team/153726/,Software Development,Hybrid
Software Platform Engineer Team Lead בחברת סטארט-אפ ב-Stealth,GotFriends,Tel Aviv,2026-05-10,https://www.gotfriends.co.il/jobslobby/software/head-of-development-team/153719/,Software Development,Hybrid
Staff Backend Engineer בחברת סטארט-אפ בתחום AI EdTech,GotFriends,Tel Aviv,2026-05-10,https://www.gotfriends.co.il/jobslobby/software/python-developer/153704/,Software Development,Hybrid
AI Software Team Lead בחברת סטארט-אפ ביטחונית מבוססת AI ו-Computer Vision,GotFriends,Tel Aviv,2026-05-10,https://www.gotfriends.co.il/jobslobby/software/head-of-development-team/153716/,Software Development,Hybrid
Hands-On AI Architect בחברת הייטק גלובלית בתחום ה-Medical,GotFriends,Jerusalem,2026-05-10,https://www.gotfriends.co.il/jobslobby/software/ארכיטקט-תוכנה/153723/,Software Development,Hybrid
Windows C++ Developer בחברת Cybersecurity,GotFriends,Tel Aviv,2026-05-10,https://www.gotfriends.co.il/jobslobby/software/cplusplus-programmer/153710/,Software Development,Hybrid
Senior Software Engineer בחברת הייטק בתחום השבבים,GotFriends,Tel Aviv,2026-05-10,https://www.gotfriends.co.il/jobslobby/software/net-developer/153728/,Software Development,Hybrid
Backend Team Lead בחברת סטארט-אפ בתחום ה-AI,GotFriends,Tel Aviv,2026-05-10,https://www.gotfriends.co.il/jobslobby/software/head-of-development-team/153679/,Software Development,Hybrid
Backend Team Lead (C++) בחברת סטארט-אפ בתחום הרחפנים למגזר ביטחוני צבאי,GotFriends,Tel Aviv,2026-05-10,https://www.gotfriends.co.il/jobslobby/software/head-of-development-team/153696/,Software Development,Remote
Frontend Developer בחברת הייטק בתחום ה-AdTech,GotFriends,Tel Aviv,2026-05-10,https://www.gotfriends.co.il/jobslobby/software/frontend-developer/153681/,Software Development,Hybrid
Software Engineering Manager בחברת Cloud Security,GotFriends,Tel Aviv,2026-05-10,https://www.gotfriends.co.il/jobslobby/software/head-of-development-team/153700/,Software Development,Hybrid
Senior Software Engineer בחברת הייטק בתחום השבבים,GotFriends,Tel Aviv,2026-05-10,https://www.gotfriends.co.il/jobslobby/software/java-developer/153698/,Software Development,Hybrid
Software QA Engineer/Senior בחברת הייטק בתחום השבבים,GotFriends,Tel Aviv,2026-05-10,https://www.gotfriends.co.il/jobslobby/software/backend-developer/153697/,Software Development,Hybrid
Software Developer בחברת סטארט-אפ דיסקרטי בתחום ה-DefenseTech,GotFriends,Tel Aviv,2026-05-10,https://www.gotfriends.co.il/jobslobby/software/cplusplus-programmer/153661/,Software Development,Hybrid
MLOps Engineer בחברת סטארט-אפ,GotFriends,Tel Aviv,2026-05-10,https://www.gotfriends.co.il/jobslobby/software/python-developer/153657/,Software Development,onsite
Senior Backend Engineer NodeJS בחברה בתחום ה-Fintech,GotFriends,Tel Aviv,2026-05-10,https://www.gotfriends.co.il/jobslobby/software/nodejs-developer/153667/,Software Development,Hybrid
Software Engineer בחברת הייטק רווחית,GotFriends,Tel Aviv,2026-05-10,https://www.gotfriends.co.il/jobslobby/software/backend-developer/153659/,Software Development,Hybrid
Mobile Team Lead בחברה בתחום ה-Security Ad-Tech,GotFriends,Tel Aviv,2026-05-10,https://www.gotfriends.co.il/jobslobby/software/head-of-mobile-team/153673/,Software Development,Hybrid
Software Team Lead בחברת בינלאומית,GotFriends,Tel Aviv,2026-05-10,https://www.gotfriends.co.il/jobslobby/software/head-of-development-team/153645/,Software Development,Hybrid
Senior Data Engineer בחברת סטארט-אפ בתחום ה-Fintech,GotFriends,Tel Aviv,2026-05-10,https://www.gotfriends.co.il/jobslobby/software/data-engineer/153616/,Software Development,Hybrid
Frontend Tech Lead בחברת סטארט-אפ העוסקת בעולמות של Data,GotFriends,Tel Aviv,2026-05-10,https://www.gotfriends.co.il/jobslobby/software/frontend-developer/153653/,Software Development,Hybrid
CI Infrastructure & Platform בחברת הייטק מצליחה,GotFriends,Tel Aviv,2026-05-10,https://www.gotfriends.co.il/jobslobby/software/python-developer/153650/,Software Development,Hybrid
Backend Team Lead בחברת סטארט-אפ בתחום Cyber Security ו-Identity Management,GotFriends,Tel Aviv,2026-05-10,https://www.gotfriends.co.il/jobslobby/software/head-of-development-team/153652/,Software Development,onsite
Backend Developer בחברת סטארט-אפ בתחום Data Infrastructure and Analytics,GotFriends,Tel Aviv,2026-05-10,https://www.gotfriends.co.il/jobslobby/software/python-developer/153613/,Software Development,Hybrid
Agent Developer Team Lead בחברת Cyber Offensive ייחודית,GotFriends,Tel Aviv,2026-05-10,https://www.gotfriends.co.il/jobslobby/software/head-of-development-team/153583/,Software Development,onsite
Backend Lead בחברת סטארט-אפ בתחום ה-Fintech & LegalTech,GotFriends,Israel,2026-05-10,https://www.gotfriends.co.il/jobslobby/software/head-of-development-team/153588/,Software Development,Hybrid
פיתוח IOS משולב Android בחברת סטארט-אפ בתחום ה-IoT,GotFriends,Tel Aviv,2026-05-10,https://www.gotfriends.co.il/jobslobby/software/mobile-programmer/153598/,Software Development,Hybrid
Senior Backend Developer בסטארט-אפ גלובאלי,GotFriends,Tel Aviv,2026-05-10,https://www.gotfriends.co.il/jobslobby/software/java-developer/153608/,Software Development,Hybrid
Full Stack Engineer- AI Datacenter Orchestration בחברת הייטק מצליחה,GotFriends,Tel Aviv,2026-05-10,https://www.gotfriends.co.il/jobslobby/software/full-stack-developer/153604/,Software Development,Hybrid
Full Stack Developer בחברת הייטק רפואית בתחום Digital Health ו-Computer Vision,GotFriends,Tel Aviv,2026-05-10,https://www.gotfriends.co.il/jobslobby/software/full-stack-developer/153606/,Software Development,Hybrid
Founding Engineer בחברת סטארט-אפ בתחום ה-Cyber,GotFriends,Tel Aviv,2026-05-10,https://www.gotfriends.co.il/jobslobby/software/backend-developer/153563/,Software Development,onsite
Senior Full Stack Engineer בחברת Cyber Offensive ייחודית,GotFriends,Tel Aviv,2026-05-10,https://www.gotfriends.co.il/jobslobby/software/full-stack-developer/153565/,Software Development,onsite
Agent Developer- OS Security R&D בחברת Cyber Offensive ייחודית,GotFriends,Tel Aviv,2026-05-10,https://www.gotfriends.co.il/jobslobby/software/cplusplus-programmer/153582/,Software Development,onsite
Senior Backend Developer בחברת Cyber Offensive ייחודית,GotFriends,Tel Aviv,2026-05-10,https://www.gotfriends.co.il/jobslobby/software/backend-developer/153566/,Software Development,onsite
Full-Stack R&D Team Lead בחברת סטארט-אפ פורצת דרך,GotFriends,Tel Aviv,2026-05-10,https://www.gotfriends.co.il/jobslobby/software/head-of-development-team/153577/,Software Development,Hybrid
Backend Lead בחברת סטארט-אפ שעוסקת בתחום ה-Adtech,GotFriends,Tel Aviv,2026-05-10,https://www.gotfriends.co.il/jobslobby/software/head-of-development-team/153569/,Software Development,onsite
Software Engineer בחברת הייטק מצליחה,GotFriends,Tel Aviv,2026-05-10,https://www.gotfriends.co.il/jobslobby/software/backend-developer/153564/,Software Development,Hybrid
Full-Stack Developer בחברת Bootstrap יציבה,GotFriends,Tel Aviv,2026-05-10,https://www.gotfriends.co.il/jobslobby/software/full-stack-developer/154060/,Software Development,onsite
Senior Full stack engineer בסטארט-אפ בתחום Fintech Generative AI,GotFriends,Tel Aviv,2026-05-10,https://www.gotfriends.co.il/jobslobby/software/full-stack-developer/153548/,Software Development,Hybrid
Senior Software Engineer (Embedded & Edge AI) בחברת סטארט-אפ,GotFriends,Tel Aviv,2026-05-10,https://www.gotfriends.co.il/jobslobby/software/backend-developer/153562/,Software Development,Hybrid
Senior Software Engineer (Embedded & Edge AI) בחברת סטארט-אפ,GotFriends,Tel Aviv,2026-05-10,https://www.gotfriends.co.il/jobslobby/software/cplusplus-programmer/153562/,Software Development,Hybrid
Engineering Lead בחברת סטארט-אפ רווחית בתחום של עיצוב פנים ו-AI,GotFriends,Tel Aviv,2026-05-10,https://www.gotfriends.co.il/jobslobby/software/full-stack-developer/153535/,Software Development,onsite
R&D Backend Team Lead בחברת סטארט-אפ בתחום ה-Creative Technology,GotFriends,Tel Aviv,2026-05-10,https://www.gotfriends.co.il/jobslobby/software/head-of-development-team/153545/,Software Development,Hybrid
Principal Backend Engineer- AI Platform בחברת הייטק מצליחה,GotFriends,Tel Aviv,2026-05-10,https://www.gotfriends.co.il/jobslobby/software/backend-developer/153551/,Software Development,Hybrid
Linux Kernel Developer בחברת הייטק מצליחה,GotFriends,Tel Aviv,2026-05-10,https://www.gotfriends.co.il/jobslobby/software/backend-developer/153552/,Software Development,Hybrid
Senior Full Stack Engineer בחברת סטארט-אפ,GotFriends,Tel Aviv,2026-05-10,https://www.gotfriends.co.il/jobslobby/software/full-stack-developer/153522/,Software Development,Hybrid
Senior Software Engineer בחברה בתחום ה-Ad-tech,GotFriends,Tel Aviv,2026-05-10,https://www.gotfriends.co.il/jobslobby/software/backend-developer/153502/,Software Development,Hybrid
Full Stack Developer בחברת סטארט-אפ בתחום ה-AI,GotFriends,Tel Aviv,2026-05-10,https://www.gotfriends.co.il/jobslobby/software/full-stack-developer/153528/,Software Development,Hybrid
Senior Full Stack Engineer בחברת הייטק בתחום הרפואי,GotFriends,Tel Aviv,2026-05-10,https://www.gotfriends.co.il/jobslobby/software/full-stack-developer/153464/,Software Development,Hybrid
Team Lead בחברת תוכנה בעולם הפרסום הדיגיטלי,GotFriends,Tel Aviv,2026-05-10,https://www.gotfriends.co.il/jobslobby/software/net-developer/153505/,Software Development,Hybrid
Senior Full Stack Developer בחברה בתחום הביטחוני,GotFriends,Tel Aviv,2026-05-10,https://www.gotfriends.co.il/jobslobby/software/full-stack-developer/153506/,Software Development,Hybrid
Senior Full Stack Developer בחברה בתחום הביטחוני,GotFriends,Tel Aviv,2026-05-10,https://www.gotfriends.co.il/jobslobby/software/full-stack-developer/153508/,Software Development,Hybrid
Founding Engineer בחברת סטארט-אפ AI First,GotFriends,Tel Aviv,2026-05-10,https://www.gotfriends.co.il/jobslobby/software/python-developer/153479/,Software Development,Hybrid
Backend Team Lead בחברת Gaming,GotFriends,Tel Aviv,2026-05-10,https://www.gotfriends.co.il/jobslobby/software/head-of-development-team/153468/,Software Development,Hybrid
Lead Backend engineer בחברת הייטק בתחום ה-Healthcare,GotFriends,Sharon,2026-05-10,https://www.gotfriends.co.il/jobslobby/software/backend-developer/153480/,Software Development,Remote
Engineering Team Lead בחברה בתחום ה-Fintech,GotFriends,Tel Aviv,2026-05-10,https://www.gotfriends.co.il/jobslobby/software/head-of-development-team/153455/,Software Development,Hybrid
System Architect בחברת הייטק,GotFriends,Tel Aviv,2026-05-10,https://www.gotfriends.co.il/jobslobby/software/ארכיטקט-תוכנה/153472/,Software Development,onsite
Senior Full Stack Engineer בחברת הייטק בתחום הרפואי,GotFriends,Tel Aviv,2026-05-10,https://www.gotfriends.co.il/jobslobby/software/full-stack-developer/153456/,Software Development,Hybrid
Frontend Infrastructure Team Leader בחברת הייטק,GotFriends,Tel Aviv,2026-05-10,https://www.gotfriends.co.il/jobslobby/software/head-of-front-end-team/153490/,Software Development,Hybrid
Backend Engineering Team Lead בחברת סטארט-אפ בתחום ה-Fintech,GotFriends,Tel Aviv,2026-05-10,https://www.gotfriends.co.il/jobslobby/software/head-of-development-team/153450/,Software Development,Hybrid
Senior Frontend Infrastructure Engineer בחברת סטארט-אפ רווחית,GotFriends,Tel Aviv,2026-05-10,https://www.gotfriends.co.il/jobslobby/software/frontend-developer/153447/,Software Development,Hybrid
Senior Software Engineer בחברת סטארט-אפ,GotFriends,Tel Aviv,2026-05-10,https://www.gotfriends.co.il/jobslobby/software/backend-developer/153428/,Software Development,onsite
Full Stack Software Engineer בחברה ישראלית,GotFriends,Tel Aviv,2026-05-10,https://www.gotfriends.co.il/jobslobby/software/full-stack-developer/153403/,Software Development,Hybrid
Software Engineer בחברת סטארט-אפ בתחום ה-Medical,GotFriends,Tel Aviv,2026-05-10,https://www.gotfriends.co.il/jobslobby/software/python-developer/153413/,Software Development,onsite
Lead Software Engineer בחברת סטארט-אפ בתחום המיחשוב הקוונטי,GotFriends,Shfela,2026-05-10,https://www.gotfriends.co.il/jobslobby/software/cplusplus-programmer/153425/,Software Development,Hybrid
Software Engineering Lead (Sensor) בחברת סייבר רווחית,GotFriends,Tel Aviv,2026-05-10,https://www.gotfriends.co.il/jobslobby/software/backend-developer/153424/,Software Development,Hybrid
Backend Team Lead בחברה העוסקת בחווית משתמש,GotFriends,Tel Aviv,2026-05-10,https://www.gotfriends.co.il/jobslobby/software/head-of-development-team/153429/,Software Development,Hybrid
Backend Team Lead בחברה העוסקת בחווית משתמש,GotFriends,Tel Aviv,2026-05-10,https://www.gotfriends.co.il/jobslobby/software/backend-developer/153429/,Software Development,Hybrid
Senior Software Engineer בחברת הייטק בתחום ה-DevSecOps ו-MLOps,GotFriends,Tel Aviv,2026-05-10,https://www.gotfriends.co.il/jobslobby/software/backend-developer/153405/,Software Development,Hybrid
Tech Lead בחברת סטארט-אפ ישראלית,GotFriends,Tel Aviv,2026-05-10,https://www.gotfriends.co.il/jobslobby/software/go-developer/153377/,Software Development,Hybrid
Senior Core Backend Infra Engineer בחברת סטארט-אפ בתחום ה- Data Security,GotFriends,Tel Aviv,2026-05-10,https://www.gotfriends.co.il/jobslobby/software/backend-developer/153401/,Software Development,Hybrid
Software Engineer בחברת Security,GotFriends,Tel Aviv,2026-05-10,https://www.gotfriends.co.il/jobslobby/software/java-developer/153381/,Software Development,Hybrid
R&D Team Leader בחברת Security,GotFriends,Tel Aviv,2026-05-10,https://www.gotfriends.co.il/jobslobby/software/head-of-development-team/153389/,Software Development,Hybrid
Senior Python Engineer בחברת מודיעין דיגיטלי בתעשיית הפורנזיקה,GotFriends,Tel Aviv,2026-05-10,https://www.gotfriends.co.il/jobslobby/software/python-developer/153402/,Software Development,Hybrid
Senior Full Stack Developer בחברת סטארט-אפ,GotFriends,Tel Aviv,2026-05-10,https://www.gotfriends.co.il/jobslobby/software/full-stack-developer/153310/,Software Development,Hybrid
Backend Team Lead בחברת סטארט-אפ בתחום ה-Fintech,GotFriends,Tel Aviv,2026-05-10,https://www.gotfriends.co.il/jobslobby/software/head-of-development-team/153329/,Software Development,Hybrid
Backend Tech Lead בחברה בתחום ה- Cyber Intelligence,GotFriends,Tel Aviv,2026-05-10,https://www.gotfriends.co.il/jobslobby/software/backend-developer/153344/,Software Development,Hybrid
Full Stack Team Lead בחברת סטארט-אפ בתחום ה- Digital Twin Software,GotFriends,Tel Aviv,2026-05-10,https://www.gotfriends.co.il/jobslobby/software/full-stack-developer/153351/,Software Development,Hybrid
Backend Engineer (NodeJS) בחברת Fintech,GotFriends,Tel Aviv,2026-05-10,https://www.gotfriends.co.il/jobslobby/software/backend-developer/153337-1/,Software Development,Remote
Senior Full Stack Developer בחברת סטארט-אפ,GotFriends,Tel Aviv,2026-05-10,https://www.gotfriends.co.il/jobslobby/software/full-stack-developer/153309/,Software Development,Hybrid
Senior Full Stack Tech Lead בחברת סטארט-אפ,GotFriends,Tel Aviv,2026-05-10,https://www.gotfriends.co.il/jobslobby/software/full-stack-developer/153314/,Software Development,Hybrid
Senior Python Backend Developer בחברת סטארט-אפ,GotFriends,Tel Aviv,2026-05-10,https://www.gotfriends.co.il/jobslobby/software/python-developer/153327/,Software Development,Hybrid
משרת פיתוח Rust בחברת סטארט-אפ בתחום ה-Retail,GotFriends,Tel Aviv,2026-05-10,https://www.gotfriends.co.il/jobslobby/software/backend-developer/153322/,Software Development,Hybrid
R&D Manager- AI Solutions Embedded Systems Security Researcher and Developer בחברת הייטק בתחום הסייבר,GotFriends,Tel Aviv,2026-05-10,https://www.gotfriends.co.il/jobslobby/software/cplusplus-programmer/153317/,Software Development,onsite
Senior Platform Engineer (Backend) בחברת סטארט-אפ בתחום הסייבר,GotFriends,Tel Aviv,2026-05-10,https://www.gotfriends.co.il/jobslobby/software/backend-developer/153242/,Software Development,Hybrid
Backend Developer- Cloud בחברת סטארט-אפ בתחום ה-Data Infrastructure,GotFriends,Tel Aviv,2026-05-10,https://www.gotfriends.co.il/jobslobby/software/backend-developer/153267/,Software Development,Hybrid
Tech Lead Backend Developer בחברת הייטק,GotFriends,Tel Aviv,2026-05-10,https://www.gotfriends.co.il/jobslobby/software/backend-developer/153241/,Software Development,onsite
R&D Team Leader בחברת הייטק בתחום ה-DevSecOps ו-MLOps,GotFriends,Tel Aviv,2026-05-10,https://www.gotfriends.co.il/jobslobby/software/head-of-development-team/153289/,Software Development,Hybrid
Director/VP Data בחברת סטארט-אפ שעוסקת בניטור פעילות פרסום ומידע עסקי,GotFriends,Tel Aviv,2026-05-10,https://www.gotfriends.co.il/jobslobby/software/data-engineer/153293/,Software Development,Hybrid
Senior Software Engineer בחברת הייטק בתחום ה-DevSecOps ו-MLOps,GotFriends,Tel Aviv,2026-05-10,https://www.gotfriends.co.il/jobslobby/software/backend-developer/153264/,Software Development,Hybrid
Senior Full Stack Software Engineer בחברת סייבר בעולמות ה-Fintech,GotFriends,Tel Aviv,2026-05-10,https://www.gotfriends.co.il/jobslobby/software/full-stack-developer/153249/,Software Development,Hybrid
Senior Platform Engineer (Backend) בחברת סטארט-אפ בתחום הסייבר,GotFriends,Tel Aviv,2026-05-10,https://www.gotfriends.co.il/jobslobby/software/backend-developer/153239/,Software Development,Hybrid
Data Engineer בחברת סטארט-אפ בתחום של Healthcare,GotFriends,Tel Aviv,2026-05-10,https://www.gotfriends.co.il/jobslobby/software/data-engineer/153247/,Software Development,Hybrid
Software Engineer בחברת סטארט-אפ בתחום ה-High-Performance Computing,GotFriends,Tel Aviv,2026-05-10,https://www.gotfriends.co.il/jobslobby/software/cplusplus-programmer/153262/,Software Development,Hybrid
Tech Lead Backend Developer בחברת הייטק,GotFriends,Sharon,2026-05-10,https://www.gotfriends.co.il/jobslobby/software/backend-developer/153238/,Software Development,onsite
Software Engineer  בחברת הייטק,GotFriends,Tel Aviv,2026-05-10,https://www.gotfriends.co.il/jobslobby/software/cplusplus-programmer/153251/,Software Development,onsite
Tech Lead בחברת סטארט-אפ רווחית,GotFriends,Tel Aviv,2026-05-10,https://www.gotfriends.co.il/jobslobby/software/frontend-developer/153263/,Software Development,Hybrid
Founding Full Stack Engineer בחברת סטארט- אפ בתחום ה-Security,GotFriends,Tel Aviv,2026-05-10,https://www.gotfriends.co.il/jobslobby/software/full-stack-developer/153232/,Software Development,onsite
Lead Software Engineer בחברת סטארט-אפ בתחום המיחשוב הקוונטי,GotFriends,Tel Aviv,2026-05-10,https://www.gotfriends.co.il/jobslobby/software/python-developer/153216/,Software Development,Hybrid
Senior Software Developer בחברת הייטק,GotFriends,Tel Aviv,2026-05-10,https://www.gotfriends.co.il/jobslobby/software/backend-developer/153212/,Software Development,onsite
Senior Software Engineer בחברת הייטק בתחום ה-Cyber Security,GotFriends,Tel Aviv,2026-05-10,https://www.gotfriends.co.il/jobslobby/software/python-developer/153223/,Software Development,Hybrid
Backend Engineer בחברת סטארט-אפ בתחום ה-Medical,GotFriends,Tel Aviv,2026-05-10,https://www.gotfriends.co.il/jobslobby/software/backend-developer/153134/,Software Development,Hybrid
Technical Lead Engineer בחברת סטארט-אפ בתחום Defense-tech,GotFriends,Tel Aviv,2026-05-10,https://www.gotfriends.co.il/jobslobby/software/java-developer/153149/,Software Development,Hybrid
Frontend Game Developer בחברת משחקים אמריקאית,GotFriends,Tel Aviv,2026-05-10,https://www.gotfriends.co.il/jobslobby/software/frontend-developer/153148/,Software Development,Remote
Full Stack Lead בחברת הייטק,GotFriends,Tel Aviv,2026-05-10,https://www.gotfriends.co.il/jobslobby/software/head-of-development-team/153169/,Software Development,onsite
Big Data Software Engineer בחברת סטארט-אפ,GotFriends,Tel Aviv,2026-05-10,https://www.gotfriends.co.il/jobslobby/software/big-data-developer/153173/,Software Development,Hybrid
Software Developer C++/Cבחברת Security,GotFriends,Tel Aviv,2026-05-10,https://www.gotfriends.co.il/jobslobby/software/cplusplus-programmer/153172/,Software Development,Hybrid
Software Architect בחברת הייטק בתחום ה-DevSecOps ו-MLOps,GotFriends,Sharon,2026-05-10,https://www.gotfriends.co.il/jobslobby/software/ארכיטקט-תוכנה/153161/,Software Development,Hybrid
Software Infrastructure Engineer בחברת הייטק בתחום השבבים,GotFriends,Tel Aviv,2026-05-10,https://www.gotfriends.co.il/jobslobby/software/java-developer/153147/,Software Development,Hybrid
React Native Mobile Engineer בחברת סטארט-אפ,GotFriends,Tel Aviv,2026-05-10,https://www.gotfriends.co.il/jobslobby/software/mobile-programmer/153129/,Software Development,Hybrid
Full Stack Developer בחברת סטארט-אפ,GotFriends,Sharon,2026-05-10,https://www.gotfriends.co.il/jobslobby/software/full-stack-developer/153097/,Software Development,Hybrid
Backend Engineer בחברת סטארט-אפ בתחום ה-Medical,GotFriends,Tel Aviv,2026-05-10,https://www.gotfriends.co.il/jobslobby/software/backend-developer/153132/,Software Development,Hybrid
Linux Team Lead בחברת Cybersecurity,GotFriends,Tel Aviv,2026-05-10,https://www.gotfriends.co.il/jobslobby/software/cplusplus-programmer/153125/,Software Development,Hybrid
Tech Lead בחברת Fintech,GotFriends,Tel Aviv,2026-05-10,https://www.gotfriends.co.il/jobslobby/software/python-developer/153109/,Software Development,Hybrid
Full Stack Team Lead בחברת סטארט-אפ בתחום ה-Mobility,GotFriends,Tel Aviv,2026-05-10,https://www.gotfriends.co.il/jobslobby/software/head-of-development-team/153128/,Software Development,Hybrid
