title,company,location,date,deadline,url,jobcode,campus,department,workplace_type,description,requirements
עובד/ת מעבדה- הפקולטה למתמטיקה ומדעי הטבע- המכון למדעי החיים,האוניברסיטה העברית בירושלים,ירושלים,2026-05-09,,https://huji.hunterhrms.com/job-details/?jobcode=JB-4918,JB-4918,"קמפוס  ע""ש אדמונד י.ספרא",,onsite,"•	סיוע והשתתפות בפרויקטים מחקריים במעבדה העוסקים בחקר עמילואידים בהקשר של מחלות נוירודגנרטיביות וזיהומיות.
•	סיוע בניהול האדמיניסטרטיבי של המעבדה ובכלל זה: ניהול מלאי, הזמנת ציוד וחומרים ועבודה מול ספקים.
•	סיוע בניהול השוטף של העבודה הניסויית במעבדה הכולל יישום, הטמעה, פיתוח של טכנולוגיות מחקר חדשות ותחזוקה שוטפת של תרביות תאים נוירונליים.
•	הפעלת ציוד המעבדה ואחריות על תחזוקתו השוטפת.
•	הדרכה ותמיכה מקצועית בסטודנטים.
•	אחריות ואכיפה של נהלי העבודה והבטיחות במעבדה.
•	מטלות נוספות בהתאם להוראות הממונים.","•	תואר שני במדעי החיים/ביולוגיה. תואר שלישי- יתרון
•	ניסיון בתחום הביולוגיה של התא ובביולוגיה מולקולרית.
•	רקע בחקר של עמילואידים ומחלות ניורודגנרטיביות- יתרון.
•	ניסיון בביטוי וניקוי חלבונים ו/או בביולוגיה מבנית- יתרון.
•	שליטה מלאה ביישומי Office ואינטרנט.
•	ידיעת השפה העברית על בוריה ואנגלית ברמה טובה מאוד.
•	יכולת למידה, יכולה הדרכה, ארגון וסדר, יכולת עבודה בצוות ויחסי אנוש מצוינים.
היקף:	משרה מלאה (חצי ע""ח תקציבי מחקר)."
עוזר/ת בכיר/ה לפיתוח אקדמי-המינהל האקדמי,האוניברסיטה העברית בירושלים,ירושלים,2026-05-09,2026-05-20,https://huji.hunterhrms.com/job-details/?jobcode=JB-4961,JB-4961,קמפוס הר הצופים,,onsite,"•	הכנה, בנייה, תחזוקה והרצה של מודל התקצוב הפנימי של האוניברסיטה, ריכוזו ופיתוחו בהתאם לפרמטרים משתנים, תוך בדיקת ההשלכות התקציביות, הארגוניות והאקדמיות.
•	פיתוח כלים, מתודולוגיות ותהליכי עבודה להטמעה של המודל בשטח והדרכה של אנשי מפתח בפקולטות לגבי המודל.
•	פיתוח ובקרה על כל הדו""חות הקשורים לנתוני הסגל האקדמי הבכיר ובהם דו""ח סגל אקדמי ודו""ח סגל רפואה.
•	יצירת תהליכי עבודה להנגשת הדוחות להנהלה ולגורמים רלוונטיים בתוך האוניברסיטה ומחוצה לה.
•	אחריות על בנייה והכנה של בסיסי נתונים עבור המדדים הבינלאומיים.
•	אחריות לבנייה ולשימוש במערכי הנתונים והדוחות בתחומים שתחת לשכת הרקטור והמינהל האקדמי, תוך שימוש מיטבי בתשתיות הנתונים הכלל מוסדיות.
•	מענה על בקשות מידע מות""ת, מהלמ""ס ומגופים נוספים הנוגעות למאגרי הנתונים של המינהל האקדמי.
•	מטלות נוספות בהתאם להוראות הממונים.","•	תואר אקדמי. תואר בכלכלה/סטטיסטיקה/מדעי המחשב/ מינהל עסקים ותחומים קרובים ו/או תואר שני בתחומים אלו-  יתרון.
•	ניסיון בעבודה בניתוח נתונים ודו""חות מערכתיים.
•	ניסון בעבודה כראש צוות או בעבודה עצמאית מול דרגי הנהלה.
•	ניסיון בעבודה בארגונים גדולים, ובפרט ניסיון בעבודה מול יחידות אקדמיות - יתרון.
•	שליטה מצוינת ב-Excel, בפרט PIVOT ונוסחאות כלכליות וסטטיסטיות מורכבות.
•	שליטה בסיסית בפייתון ובכתיבת קוד (בעיקר בחבילות כגון numpy, pandas) - יתרון.
•	הכרה ושימוש במערכת POWERBI - יתרון.
•	היכרות וניסיון בעבודה עם מערכות אוניברסיטאיות ממוחשבות - יתרון.
•	שליטה מלאה ביישומיי Office ואינטרנט.
•	ידיעת השפה העברית על בוריה והשפה האנגלית ברמה טובה.
•	יכולות אנליטיות, חשיבה שיטתית ויכולת גבוהה של הסקת מסקנות מנתונים.
•	יכולת רתימה, הובלת תהליכים והטמעת שינויים.
•	יחסי אנוש מעולים, תודעת שירות גבוהה ויכולת עבודה עצמאית ובצוות.
היקף:	משרה מלאה"
מינהלן/ית הוראה ותלמידים- מכון איינשטיין למתמטיקה- הפקולטה למתמטיקה ולמדעי הטבע,האוניברסיטה העברית בירושלים,ירושלים,2026-05-09,,https://huji.hunterhrms.com/job-details/?jobcode=JB-4977,JB-4977,"קמפוס  ע""ש אדמונד י.ספרא",,onsite,"מתן שירות לסטודנטים, לסגל האקדמי ולסגל המנהלי בנושאי הוראה ותלמידים ובכלל זה:
•	מתן מידע , ייעוץ והכוונה למתעניינים ולסטודנטים בנושאים של תוכניות הלימוד של החוג, נהלי לימודים והפניית סטודנטים לגורמים מוסמכים.
•	קבלת קהל וטיפול בנושאים השוטפים של תלמידי החוג ושל תלמידי קורסי השירות: סיוע ברישום ללימודים ולקורסים, פתיחת הקצאות, טיפול בחריגים, טיפול בפטורים ובשיוכים, קבוצות לימוד וכד'.
•	ריכוז וטיפול נושא הבחינות בחוג הכולל תכנון והכנת לוח הבחינות בתיאום עם הגורמים הרלוונטיים.
•	אחריות על נושא הציונים כולל ריכוז הנושא, מעקב אחר דיווח הציונים, טיפול בבעיות וכד'.
•	טיפול בסגירת תארי מוסמך: תיאום מבחני מוסמך, מעקב אחר מבחנים, והתזה וסגירת התארים.
•	ריכוז וטיפול בסדנאות ההכנה למתקבלים: טיפול ברישום, הקצאות, תשלומים, ביטולים וכיו""ב.
•	טיפול בוועדות החוג: תיאום מועדי הוועדות, ריכוז עבודתן, טיפול בהחלטות הוועדות וכד'.
•	סיוע בארגון ימים פתוחים, ימי אוריינטציה וטקסי החוג.
•	מטלות נוספות בהתאם להוראות הממונים.","•	תואר אקדמי.
•	ניסיון בעבודה בנושאי הוראה ותלמידים - יתרון.
•	היכרות עם מערכות ממוחשבות בתחום מנהל תלמידים (אורביט ומודל)- יתרון.
•	שליטה מלאה ביישומי Office ואינטרנט ויכולת למידה של מערכות ממוחשבות.
•	ידיעת השפה העברית על בוריה ואנגלית ברמה טובה.
•	תודעת שירות גבוהה, יחסי אנוש מצוינים, יכולת עבודה עצמית ובצוות, כושר ארגון וסדר.
•	יכולת עמידה בתנאי לחץ ועומס עבודה.
•	נכונות לעבוד בשעות נוספות, על פי הצורך.
תקן:  37-39 בדירוג מח""ר.  המשרה כוללת 575 קילומטרים.
היקף: משרה מלאה (חצי תקני+חצי ארעי)."
מנהלן/ית הוראה ותלמידים-בית הספר לרפואה- הפקולטה לרפואה,האוניברסיטה העברית בירושלים,ירושלים,2026-05-09,,https://huji.hunterhrms.com/job-details/?jobcode=JB-5042,JB-5042,קמפוס עין כרם,,onsite,"•	מתן שירותים לסטודנטים, לסגל האקדמי ולסגל המנהלי בנושאי הוראה ותלמידים.
•	סיוע לסגל בית הספר לרפואה בנושאי הוראה, לימודים ובנושאים טכניים ואדמיניסטרטיביים.
•	סיוע בתיאום לו""ז מרצים על פי הנחיות ראש תחום הוראה ותלמידים.
•	סיוע בטיפול בבחינות, תיאום בחינות, עריכה והזנה במערכות ודיווח ציונים.
•	סיוע בבדיקת זכאות לתואר, סגירת תארים והפקת אישורי לימודים וגיליונות ציונים לסטודנטים.
•	סיוע בארגון טקסים, אירועים וימים פתוחים.
•	עבודה משרדית שוטפת: מענה לפניות טלפוניות ופניות בדוא""ל ממרצים וסטודנטים
•	מטלות נוספות ושוטפות בהתאם לפרויקטים השונים ולהוראות הממונים.","•	תואר אקדמי.
•	ניסיון בעבודה אדמיניסטרטיבית.
•	שליטה מלאה ביישומי Office (Excel (  ואינטרנט.
•	הכרת מערכות הוראה ותלמידים- יתרון.
•	ידיעת השפה העברית על בוריה ואנגלית ברמה טובה.
•	תודעת שירות גבוהה, יחסי אנוש מעולים ויכולת עבודה בצוות.
•	כושר ארגון, דייקנות ועמידה בלוחות זמנים.
•	נכונות לעבודה בשעות נוספות.
היקף:	משרה מלאה"
מנהל/ת היחידה לניתוח ותכנון מדיניות- לשכת הנשיא,האוניברסיטה העברית בירושלים,ירושלים,2026-05-09,,https://huji.hunterhrms.com/job-details/?jobcode=JB-5036,JB-5036,קמפוס הר הצופים,,onsite,"מנהל/ת היחידה אמון על הובלת פעילות היחידה לצורך תמיכה בתהליכי ניתוח ותכנון מדיניות, וקידום תהליכים מרכזיים בארגון. במסגרת התפקיד, המנהל/ת ישמש/תשמש גורם מפתח בגיבוש מבנה נתונים רלוונטיים כיסוד לתהליכי קבלת החלטות של הנהלת האוניברסיטה, ובליווי תהליכי יישום תוכניות האוניברסיטה בשיתוף פעולה עם היחידות השונות.
•	יעוץ להנהלת האוניברסיטה בגיבוש מדיניות מבוססת מידע ונתונים, הכנת תוכניות לטווח קצר וארוך, ובהתוויית אסטרטגיה תומכת לקבלת החלטות בארגון.
•	סיוע במעקב שוטף אחר יישום התוכנית האסטרטגית של האוניברסיטה ותוכניות פיתוח של היחידות, זיהוי פערים ויזום צעדים לשיפור.
•	ייזום והובלת ניתוח מגמות והשוואת נתונים בין האוניברסיטה העברית לאוניברסיטאות אחרות בארץ ואוניברסיטאות מובילות בעולם,  בפרמטרים הרלוונטיים להשכלה הגבוהה.
•	פיקוח על עיבוד נתונים כלכליים/סטטיסטיים והפקת דו""חות עבור גורמים שונים באוניברסיטה.
•	הנעת תהליכי מעקב, ניתוח וטיוב מאגרי המידע המועברים לוועדה לתכנון ותקצוב (ות""ת).
•	אחריות על ביצוע מעקב שוטף אחר החלטות מל""ג/ות""ת – ניתוח המידע והשלכותיו, עדכון הנהלת האוניברסיטה והמלצה על דרכי פעולה בהתאם.
•	תכנון ופיקוח על בניית כלים לקבלת החלטות מבוססות נתונים – ייזום, פיתוח והטמעת כלים תומכי החלטה.
•	אחריות ומתן הנחיות לכתיבת מסמכים, הפקת דו""חות והכנת מצגות וחומרים מקצועיים ותמציתיים אחרים בנושאי ליבה, שישמשו כבסיס לדיוני הנהלת האוניברסיטה ולקבלת החלטות אסטרטגיות.
•	ניהול צוות היחידה – הגדרת משימות, קביעת סדרי עדיפויות, פיתוח מקצועי וליווי שוטף של הצוות.
•	משימות נוספות בהתאם להנחיות ההנהלה.","•	תואר אקדמי בסטטיסטיקה/ כלכלה/ מדע הנתונים/ תחום רלוונטי אחר.
•	ניסיון בניתוח נתונים והצגת תמונת מצב ותהליכים מורכבים בפני הנהלת הארגון או גורמים בכירים אחרים.
•	מיומנויות עבודה עם יישומי Office ועם מערכות IT ובכלל זה שליטה ב- EXCEL ובפרט PIVOT ונוסחאות כלכליות וסטטיסטיות מורכבות, היכרות ועבודה עם מערכות ERP, BI וכלי AI ברמה גבוהה מאוד.
•	היכרות טובה עם מערכת ההשכלה הגבוהה בישראל ואופן תקצובה- יתרון.
•	הכרות עם המערכת האוניברסיטאית והתרבות הארגונית באוניברסיטה- יתרון.
•	ניסיון בהובלת תהליכים ושינויים בארגונים גדולים – יתרון.
•	ניסיון בניהול צוות  עובדים- יתרון.
•	ידיעת השפה העברית על בוריה ואנגלית ברמה טובה מאוד בעל פה ובכתב.
•	יכולת תקשורת בין-אישית גבוהה בדגש על מיומנויות הצגה, שכנוע וניהול קונפליקטים.
•	יכולות אנליטיות, חשיבה שיטתית ויכולת גבוהה של הסקת מסקנות מנתונים.
•	יוזמה, יצירתיות, יכולת למידה עצמית ויכולת עבודה עצמאית ובצוות.
•	יכולת להתמודד עם ריבוי משימות ועמידה בלוחות זמנים."
ממונה על הגנת הפרטיות וניהול סיכונים- הנהלה,האוניברסיטה העברית בירושלים,ירושלים,2026-05-09,,https://huji.hunterhrms.com/job-details/?jobcode=JB-5038,JB-5038,קמפוס הר הצופים,,onsite,"•	גיבוש, יישום ופיקוח על מדיניות ונהלים בתחומי פרטיות, ליווי תהליכי ציות, חופש המידע וניהול סיכונים תפעוליים בלשכת מנכ""ל, וכן ייעוץ שוטף להנהלה וליחידות האוניברסיטה בתחומים אלה.
•	כהונה כממונה על הגנת הפרטיות של האוניברסיטה וליווי פרויקטים ומערכות, לרבות ביצוע תסקירי השפעה על פרטיות (DPIA).
•	הבטחת עמידת האוניברסיטה בדרישות הדין והרגולציה בכל הקשור לחוק הגנת הפרטיות, חוק חופש המידע וכל הוראת דין רלוונטית אחרת.
•	דיווח לגורמים רגולטורים בהתאם לדין וייצוג האוניברסיטה מולם בתאום עם הלשכה המשפטית.
•	זיהוי, מיפוי והערכת סיכונים תפעוליים בתחומי פעילות האוניברסיטה וליווי תהליכי טיפול ובקרה.
•	ביצוע סקרי פערים וביקורות תקופתיות והובלת תהליכי תיקון ושיפור.
•	ניהול אירועי פרטיות ואבטחת מידע בשיתוף גורמי  IT, אבטחת מידע ולשכה משפטית.
•	בחינת היבטי פרטיות וציות בהתקשרויות עם ספקים וגורמי חוץ.
•	כהונה כממונה על חופש המידע, טיפול בפניות הציבור ויישום הוראות החוק.
•	ריכוז תחום הביקורת והמעקב בלשכת המנכ""לית תוך ריכוז הטיפול בדוחות מבקר האוניברסיטה, מעקב אחר יישום המלצות וריכוז הטיפול בדוחות מבקר המדינה.
•	ליווי וריכוז גופי הבת של האוניברסיטה בלשכת מנכ""ל.
•	השתלבות בצוותי עבודה ופרויקטים רוחביים לפי החלטת ממונה.
•	ריכוז ועדות אוניברסיטאיות הנוגעות לתחומי האחריות.
•	מטלות נוספות בהתאם להוראות הממונים.
*כפיפות למנכ""לית האוניברסיטה","•	תואר ראשון במשפטים. תואר שני בתחום- יתרון.
•	ניסיון של 5 שנים לפחות באחד או יותר מהתחומים: הגנת פרטיות, טכנולוגיה, אבטחת מידע, ציות, ניהול סיכונים, ביקורת או רגולציה.
•	ידע מעמיק בדיני הגנת הפרטיות והבנה טובה בטכנולוגיה ואבטחת מידע.
•	ניסיון בעבודה מול רגולטורים או גופי ביקורת.
•	ניסיון בהובלת תהליכים רוחביים והטמעת מדיניות ארגונית.
•	ניסיון בעבודה בארגון גדול ומורכב- יתרון.
•	הסמכות מקצועיות כגון CIPP, CIPM, CISA או מקבילות- יתרון.
•	שליטה מלאה ביישומי Office ואינטרנט.
•	ידיעת השפה העברית על בוריה ואנגלית ברמה טובה, כולל כושר ביטוי וניסוח גבוהים בכתב ובעל פה.
•	יכולת הובלה והנעה בסביבה ארגונית מורכבת, עצמאות, יוזמה ויכולת עבודה מול ממשקים רבים.
•	חשיבה מערכתית, יכולת ניתוח גבוהה, יושרה, דיסקרטיות ושיקול דעת.
היקף:	משרה מלאה"
רכז/ת תוכנית דוקטורנטים ובינלאומיות- הפקולטה למדעי החברה,האוניברסיטה העברית בירושלים,ירושלים,2026-05-09,,https://huji.hunterhrms.com/job-details/?jobcode=JB-5020,JB-5020,קמפוס הר הצופים,,onsite,"•	ריכוז תכנית הדוקטורנטים של הפקולטה וסיוע לראשת התוכנית בפיתוח תכנית שנתית ויוזמות חדשות.
•	ניהול תקציב התוכנית.
•	אחריות וניהול פעילות התוכנית: מפגשים, אירועים, סדנאות הוראה והעשרה, תאום מרצים, כיתות, ציוד, טיפול במלגות ובמענקי נסיעה ועוד.
•	ריכוז וטיפול בנושאים שוטפים הקשורים לתוכנית הדוקטורנטים מול גופי הפקולטה.
•	תכלול הטיפול באורחים בינלאומיים המגיעים למחלקות, כולל פוסטדוקטורנטים, לרבות קליטתם במערכות.
•	עבודה ותאום עם הרשות לבינלאומיות והמינהל האקדמי בכל הקשור לאורחים בינלאומיים.
•	אחריות כוללת על תחום הסכמים בינלאומיים בפקולטה, לרבות טיפול באורחים המגיעים לארץ במסגרת זו (חוקרים, סטודנטים ופוסטדוקטורנטים) בתאום עם גורמי הפקולטה והאוניברסיטה.
•	סיוע בתחום פיתוח תוכניות בינלאומיות בשיתוף עם ראש תחום הוראה ותלמידים ודיקן מכהן (תואר, קורסים, התמחויות).
•	משימות נוספות בהתאם להוראות הממונים.","•	תואר אקדמי. תואר שני- יתרון.
•	ניסיון אדמיניסטרטיבי קודם.
•	ניסיון בניהול תקציב ו/או בנושאי כח אדם-  יתרון.
•	היכרות עם תחום בינלאומיות באקדמיה – יתרון.
•	הכרות עם מערכות מחשב אוניברסיטאיות- יתרון.
•	ידיעת השפה העברית על בוריה ואנגלית ברמה טובה מאוד (כולל כושר הבעה בכתב ובעל-פה בשתי השפות). ידיעת שפות נוספות- יתרון.
•	שליטה מלאה ביישומי   Officeואינטרנט.
•	יכולת ניהול עצמי של משימות לצד יכולת לעבוד בצוות.
•	יחסי אנוש מעולים, יכולת עבודה בצוות ותודעת שירות גבוהה.
היקף:	משרה מלאה."
רכז/ת תקציבי מחקר-המכון לפיזיקה יישומיתהפק' למדעי הטבע,האוניברסיטה העברית בירושלים,ירושלים,2026-05-09,2026-05-17,https://huji.hunterhrms.com/job-details/?jobcode=JB-5037,JB-5037,"קמפוס  ע""ש אדמונד י.ספרא",,onsite,"סיוע אדמיניסטרטיבי לחוקרים ולסטודנטים במכון לפיזיקה יישומית, ובכלל זה:
•	מתן שירותים אדמיניסטרטיביים לחוקרי המכון, לצוות המנהלי ולסטודנטים.
•	טיפול בתקצוב העסקת עובדים במעבדות המחקר של המכון.
•	הכנת דוחות כספיים וסיוע בניהול ובקרה של מענקי המחקר מול הרשות למו""פ.
•	הזמנת שירותים וציוד מספקי פנים ומספקי חוץ, טיפול בתשלומים, החזר הוצאות ומעקב אחר ביצוע.
•	טיפול במינויים ובמלגות לסטודנטים ופוסט-דוקטורנטים.
•	טיפול בבקשות נסיעות של החוקרים והסטודנטים לכנסים בארץ ובחו""ל.
•	טיפול במרצים, פוסט-דוקטורנטים ודוקטורנטים אורחים מחו""ל בכל נושא הקליטה והשהות.
•	ארגון ותיאום כנסים מחקריים ואירועים אקדמיים בינלאומיים.
•	עדכון והעלאת תכנים לאתרי האינטרנט וטיפול בפרסומים.
•	מטלות נוספות בהתאם להוראות הממונים.","•	תואר אקדמי.
•	ניסיון קודם בעבודה אדמיניסטרטיבית.
•	ידע וניסיון בהנהלת חשבונות/ טיפול בתקציבים- יתרון.
•	ניסיון בעבודה עם המערכות הממוחשבות באוניברסיטה- יתרון.
•	הכרות עם יחידות האוניברסיטה (כספים, רשות למו""פ) - יתרון.
•	שליטה מלאה ביישומי Office ואינטרנט.
•	ידיעת השפה העברית על בוריה ואנגלית ברמה טובה.
•	יוזמה, יכולת ארגון וסדר, יכולת עבודה בצוות, יחסי אנוש מעולים ותודעת שירות גבוהה.
היקף:	משרה מלאה"
מנהלן/ית הוראה ותלמידים- הפקולטה לרפואה- בית הספר לרפואה,האוניברסיטה העברית בירושלים,ירושלים,2026-05-09,,https://huji.hunterhrms.com/job-details/?jobcode=JB-5035,JB-5035,קמפוס עין כרם,,onsite,"•	מתן שירות ומידע לסגל אקדמי ולסטודנטים בנושא הוראה ותלמידים.
•	דיווח ועדכון נתונים במערכות ההוראה.
•	אחריות וטיפול בקורסי המבואות.
•	ריכוז בחינות של תלמידי רפואה (עריכה, שכפול והעברה לגורמים רלוונטיים).
•	אחריות על דיווח ציונים ובכלל זה: ציוני המחלקות, ציונית בחינות גמר ובחינות ארציות.
•	בדיקת זכאות לתואר, הפקת אישורים וסגירת תארים.
•	ריכוז התאמות לימודיות של הסטודנט.
•	ריכוז וטיפול בבקשות סטודנטים לשנת חופשה.
•	סיוע בארגון טקסים ואירועים של בית הספר.
•	מטלות נוספות ושוטפות בהתאם לפרויקטים השונים ולהוראות הממונים.","•	תואר אקדמי.
•	ניסיון בעבודה בנושאי הוראה ותלמידים- יתרון.
•	היכרות עם מערכת אורביט- יתרון.
•	שליטה מלאה ביישומי office, כולל Excel ברמה טובה.
•	ידיעת השפה העברית על בוריה ואנגלית ברמה טובה.
•	תודעת שירות גבוהה, יחסי אנוש מעולים ויכולת עבודה בצוות.
•	עמידה בזמנים ותיעדוף משימות, כושר ארגון וסדר.
היקף: משרה מלאה."
