title,company,location,date,deadline,url,jobcode,campus,department,workplace_type,description,requirements
רכז/ת אדמיניסטרטיבי/ת- המכון למחקר רפואי ישראל-קנדה והמרכז לחקר התמכרויות- הפקולטה לרפואה,האוניברסיטה העברית בירושלים,ירושלים,2026-05-09,,https://huji.hunterhrms.com/job-details/?jobcode=JB-5034,JB-5034,קמפוס עין כרם,,onsite,"אחריות על כלל הפעילות הארגונית והתפעולית, הנוגעת לתמיכה בראש המכון ולניהול מרכז מחקר התמכרויות, ובכלל זה:
•	ניהול יומן מורכב, תיאום פגישות, ביקורים וישיבות ומעקב אחר משימות ופרויקטים של ראש המכון.
•	טיפול בהיבטים תקציביים עבור ראש המכון: רכש, הזמנות, חשבוניות ודוחות תקציביים.
•	סיוע אדמיניסטרטיבי למרכז לחקר התמכרויות: ניהול תקציב, הפקת אירועים, ניהול ציוד ושירותים ועבודה מול מרצים ואורחים.
•	תיאום, פרסום ותפעול סמינרים שבועיים, ביקורי מרצים אורחים ואירועים אקדמיים.
•	ריכוז ותמיכה בוועדות אקדמיות ומקצועיות: הכנת חומרים, תיאום ישיבות, מעקב ויישום החלטות והפצת מידע.
•	ניהול תחום פרסים ומלגות במכון: פרסום קולות קוראים, ריכוז מועמדויות, דיווחים, הודעות זוכים ותיאום טקסים ואירועים נלווים, כולל תמיכה בתוכנית המצטיינים.
•	הקמה, עדכון וניהול שוטף של אתרי האינטרנט של המכון והמרכז, כולל איסוף חומרים ועבודה מול אגף השיווק.
•	תקשורת שוטפת עם סגל, סטודנטים, מרצים ואורחים, כולל הפצה וקבלת הודעות.","•	תואר אקדמי.
•	ניסיון בעבודה אדמיניסטרטיבית.
•	שליטה מלאה ביישומי Office ואינטרנט.
•	ידיעת השפה העברית על בוריה ואנגלית ברמה טובה.
•	יחסי אנוש מעולים, תודעת שירות גבוהה ויכולת עבודה בצוות.
•	דייקנות, כושר ארגון, יוזמה חריצות ודיסקרטיות.
•	נכונות לעבודה בשעות נוספות במידת הצורך.
היקף:	משרה מלאה (חצי ע""ח תקציבי מחקר)."
טכנופדגוג- היחידה להוראה ולמידה,האוניברסיטה העברית בירושלים,ירושלים,2026-05-09,,https://huji.hunterhrms.com/job-details/?jobcode=JB-5017,JB-5017,קמפוס הר הצופים,,onsite,"הובלה והטמעה של מערכות למידה ממוחשבות ופתרונות דיגיטליים תומכי הוראה ולמידה בקרב סגל אקדמי ומנהלי ובכלל זה:
•	פיתוח והנגשה של חומרי למידה דיגיטליים וכלים אינטראקטיביים, לרבות כלי בינה מלאכותית.
•	מתן מענה שוטף לסגל ההוראה באוניברסיטה בהטמעת שיטות הוראה ולמידה חדשניות תוך מתן עזרה פדגוגית וטכנולוגית.
•	כתיבת מערכי הדרכה לכלל מערכות ההוראה הממוחשבות ועדכונם השוטף.
•	מתן מענה שוטף לרכזי תמיכה בטכנולוגיות להוראה ולמידה ומתאמי מחשוב יחידתיים.
•	מטלות נוספות בהתאם להנחיות הממונים.","•	תואר אקדמי. תואר בטכנולוגיות למידה/ מערכות מידע/ חינוך/ מדעי המחשב. תואר שני- יתרון.
•	ידע וניסיון במערכות למידה ממוחשבות. הכרת מערכת Moodle- יתרון.
•	ניסיון עם טכנולוגיות הוראה- יתרון.
•	ניסיון בעבודה בסביבה אקדמית- יתרון.
•	היכרות עם מערכות -AI יתרון.
•	שליטה מלאה ביישומי Office ואינטרנט.
•	ידיעת השפה העברית על בוריה ואנגלית ברמה טובה.
•	יחסי אנוש מצוינים ויכולת עבודה עם קהל מגוון ובממשקים מרובים.
•	נכונות לעבודה בשעות נוספות במידת הצורך.
היקף: חצי משרה."
מומחה/ית מערכות הזדהות-האגף למחשוב,האוניברסיטה העברית בירושלים,ירושלים,2026-05-09,2026-05-11,https://huji.hunterhrms.com/job-details/?jobcode=JB-4760,JB-4760,"קמפוס  ע""ש אדמונד י.ספרא",,onsite,"•	שותף בכיר בצוות פיתוח מערכות IDM האוניברסיטאיות.
•	פיתוח ותחזוקת המערכות הקיימות וכתיבת מערכות חדשות המתממשקות לקיימות.
•	שילוב מוצרים חיצוניים במערכות, כולל מוצרים מסחריים ומוצרי קוד פתוח.
•	כתיבת ממשקים חדשים למערכות חיצוניות.
•	פיתוח במערך מסדי הנתונים של מערכת ה-IDM, ופיתוח בתוכנות עזר.
•	משימות נוספות בהתאם לדרישות הממונים.","•	תעודת בגרות מלאה. תואר במדעי המחשב או לחליפין תעודת הנדסאי תוכנה/חומרה – יתרון.
•	ניסיון של 3 שנים ב-MYSQL, כולל פרוצדורות ו-Triggers.
•	ניסיון בעבודה במערכות גדולות מרובות תשתיות מורכבות - יתרון.
•	ידע ב-LINUX כמשתמש מתקדם.
•	ידע בשפת תכנות מודרנית (Python וכד’).
•	יכולת למידה של פרוטוקולים ומוצרים מורכבים.
•	היכרות פרוטוקולי הזדהות: SAML2, OAUTH, LDAP – יתרון.
•	ידע ב-JAVA- יתרון.
•	ידע ב-PHP- יתרון.
•	ידע במערכת NetIQ IDM – יתרון.
•	ידיעת השפה העברית על בוריה ואנגלית טכנית ברמה טובה.
•	יחסי אנוש טובים, יוזמה ויכולת עבודה בצוות."
מנהלן/ית הוראה ותלמידים- הפקולטה למשפטים,האוניברסיטה העברית בירושלים,ירושלים,2026-05-09,2026-05-10,https://huji.hunterhrms.com/job-details/?jobcode=JB-4935,JB-4935,קמפוס הר הצופים,,onsite,"•	ריכוז וטיפול בפניות תלמידי בוגר ובכלל זה: סיוע ברישום לקורסים, מתן מידע על תכנית הלימודים, הנפקת אישורים לראיונות ולהתמחות ועוד.
•	קבלת קהל ומתן מידע לסטודנטים בנושאי הוראה ותלמידים.
•	טיפול והכנסת שאלוני בחינות למערכת מודל בחינות.
•	אישור ציוני קורסי בחירה וסמינרים במערכת האורביט, כולל ניהול בקשות להארכת זמן וטיפול בערעורים.
•	מעקב אחר התקדמות הסטודנטים בהתאם לדרישות התואר
•	ריכוז פניות ותמיכה במערכת האורביט מול גורמים אחרים במזכירויות החוגים של משפטים וקרימינולוגיה
•	עבודה משרדית שוטפת במזכירות תלמידים: מענה לפניות טלפוניות ופניות בדוא""ל ממרצים וסטודנטים והפקת דוחות נתונים.
•	סיוע בארגון טקסים ואירועים של הפקולטה.
•	מטלות נוספות בהתאם להוראות הממונים.","•	תואר אקדמי.
•	ניסיון בעבודה בנושאי הוראה ותלמידים - יתרון.
•	ניסיון בעבודה עם מערכות ממוחשבות של האוניברסיטה (אורביט ומודל) - יתרון.
•	שליטה מלאה ביישומי Office ואינטרנט, בפרט ב- Excel.
•	ידיעת השפה העברית על בוריה ואנגלית ברמה טובה.
•	יכולת עבודה בצוות, תודעת שירות גבוהה, כושר ארגון ועמידה בלוח זמנים.
היקף:  משרה מלאה"
"מנהלן/ית הוראה ותלמידים-ביה""ס לתלמידים מחו""ל ע""ש רוטברג",האוניברסיטה העברית בירושלים,ירושלים,2026-05-09,2026-05-10,https://huji.hunterhrms.com/job-details/?jobcode=JB-5031,JB-5031,"קמפוס  ע""ש אדמונד י.ספרא",,onsite,"•	אחריות על גיוס, רישום וטיפול בתהליכי קבלת סטודנטים לתוכניות מוסמך בינלאומיות.
•	ניהול קשר שוטף עם סטודנטים באמצעות ערוצים דיגיטליים ופרונטליים.
•	כתיבה ועריכה של תוכן שיווקי באנגלית עבור אתר היחידה וחומרי הפרסום.
•	תחזוקה, ניהול והרחבה של מועדון הבוגרים.
•	טיפול ועדכון בדפי ביחידה ברשתות החברתיות.
•	העברת ימי אוריינטציה והצגת התוכניות בימים פתוחים וירטואליים (באנגלית).
•	הפקה וניתוח דו""חות בנוגע לנתוני קבלת תלמידים.
•	משימות נוספות בהתאם להוראות הממונים.","•	תואר אקדמי.
•	ניסיון אדמיניסטרטיבי.
•	ניסיון בעבודה בתחום השיווק - יתרון.
•	שליטה מלאה ביישומי Office ואינטרנט.
•	ידיעת השפה העברית על בוריה ואנגלית ברמה טובה מאוד, כולל יכולת כתיבה ברמה גבוהה.
•	כושר ארגון, תודעת שירות גבוהה ויכולת לעבוד באופן עצמאי.
•	חשיבה יצירתית ואסטרטגית.
היקף:	משרה מלאה"
רכז/ת היחידה ללימודי שפות- הפקולטה למדעי הרוח,האוניברסיטה העברית בירושלים,ירושלים,2026-05-09,,https://huji.hunterhrms.com/job-details/?jobcode=JB-5003,JB-5003,קמפוס הר הצופים,,onsite,"ריכוז ותפעול כלל היבטי הפעילות של היחידה ללימודי שפות, בהתאם להנחיות ממונה אקדמי ומנהלי. התפקיד כולל:
•	מתן מענה שוטף לסטודנטים ולסגל היחידה (פרונטלי, טלפוני ובדוא""ל), ומתן מידע למתעניינים.
•	אחריות על רישום סטודנטים מכלל התארים לקורסי השפה, כולל תיאום מבדקי רמות ופטורים.
•	סיוע בבניית תוכנית הלימודים השנתית ושיבוץ הקורסים בתיאום עם הגורמים הרלוונטיים בפקולטה ובאוניברסיטה.
•	ניהול מערך הבחינות, פיקוח על הזנת ציונים וטיפול בערעורים.
•	ניהול מערך ספרי הלימוד (מול יבואנים), מעקב רכישות וחלוקה.
•	ארגון לוגיסטי של אירועים והשתלמויות יחידתיות.
•	אחריות על מתקני היחידה, מעקב ציוד, ניקיון ותחזוקה שוטפת של החדרים.
•	ביצוע מטלות נוספות בהתאם להנחיות הממונים.","•	תואר אקדמי.
•	ניסיון אדמיניסטרטיבי קודם.
•	שליטה מלאה ביישומי Office ואינטרנט.
•	היכרות עם מערכות המידע של האוניברסיטה – יתרון משמעותי.
•	ידיעת השפה העברית על בוריה ואנגלית ברמה טובה.
•	כושר ארגון, ניהול ותיעדוף משימות בסביבה מרובת משימות, יחסי אנוש מעולים, יכולת עבודה בצוות, דייקנות, יוזמה וגמישות.
•	ניסיון בסביבת עבודה רב-תרבותית – יתרון.
•	נכונות לעבודה בשעות נוספות במידת הצורך.
תקן:  37-39 בדרוג מח""ר.  המשרה כוללת רמת רכב א'.
היקף:  משרה מלאה."
עוזר/ת לראשת המדור להכשרה מקצועית ומעורבות חברתית- בית הספר לעבודה סוציאלית ולרווחה חברתית,האוניברסיטה העברית בירושלים,ירושלים,2026-05-09,,https://huji.hunterhrms.com/job-details/?jobcode=JB-5030,JB-5030,קמפוס הר הצופים,,onsite,"•	ריכוז התוכנית למעורבות החברתית ובכלל זה: תפעול מקצועי של התוכנית, גיוס מדריכים, הדרכה וליווי שוטף של המדריכים והמדריכות, ניהול קשר מול ארגונים חיצוניים וביצוע שיבוצי סטודנטים.
•	השתתפות בהובלה של תהליכים ארגוניים במדור.
•	ניהול יומן פגישות דינמי.
•	ריכוז והפקה של אירועי המדור וימי שיא.
•	ריכוז נתונים במערכות הממוחשבות, מעקב ובקרה אחר תהליכי הערכה ומשוב וניטור איכות ההדרכה.
•	עבודה שוטפת ותיאום מול רכזות המרכזים, מדריכים וגורמי פנים וחוץ באוניברסיטה.
•	מטלות נוספות בהתאם להוראות הממונים.","•	תואר אקדמי . תואר בעבודה סוציאלית- יתרון.
•	ניסיון קודם בעבודה אדמיניסטרטיבית.
•	ניסיון בהדרכה וליווי צוותים -יתרון.
•	ידיעת השפה העברית על בוריה ואנגלית ברמה טובה.
•	שליטה מלאה ביישומי Office , אינטרנט ויכולת למידה של מערכות חדשות.
•	יחסי אנוש מעולים, תודעת שירות גבוהה ויכולת עבודה בצוות.
•	יוזמה, דייקנות, אחריות אישית ויכולת הובלת תהליכים עצמאית.
היקף:	חצי משרה."
מנהל/ת היחידה לתשתיות מחקר- הרשות למחקר ופיתוח,האוניברסיטה העברית בירושלים,ירושלים,2026-05-09,,https://huji.hunterhrms.com/job-details/?jobcode=JB-5029,JB-5029,"קמפוס  ע""ש אדמונד י.ספרא",,onsite,"ניהול והובלה של היחידה המרכזית לתשתיות מחקר ובכלל זה:
•	מיפוי תשתיות מחקר קיימות אל מול מיפוי צרכים רוחביים של יחידות האוניברסיטה השונות.
•	גיבוש תכנית עבודה רב־שנתית לפיתוח תשתיות המחקר, זיהוי מגמות עתידיות והמלצות לפיתוחים חדשים.
•	הובלת פרויקטים לשדרוג והקמת תשתיות חדשות, בתיאום עם יחידות רכש, תקציבים ואב""ת.
•	הבטחת שימוש יעיל במשאבי יחידות התשתית והנגשתם לחוקרים וליחידות שונות.
•	ניהול תקציב ותכנון משאבים: הכנת תקציבי פיתוח ותפעול, איגום מקורות מימון, הטמעת מנגנוני תמחור ובקרה.
•	ניהול צוות, פיתוח מקצועי והכשרה.
•	תיאום ושיתוף פעולה עם גורמי פנים באוניברסיטה ועם משרדי ממשלה, קרנות וגופים חיצוניים לקידום השקעות בתשתיות מחקר.
•	ייזום ופיתוח שיתופי פעולה עם מוסדות בארץ ובעולם בתחומי תשתיות המחקר.
•	ייצוג האוניברסיטה בפורומים מקצועיים מול גופים ממשלתיים, רגולטוריים ואקדמיים בארץ ובחו""ל.
•	מטלות נוספות בהתאם להוראות הממונים.
כפיפות למנהלת הרשות למו""פ ולסגן הנשיא למו""פ.","•	תואר ראשון בכלכלה/ מנהל עסקים/ חשבונאות/ מדעים ניסויים או תחום רלוונטי אחר. תואר שני ומעלה – יתרון.
•	ניסיון מוכח בניהול תקציבים, בניית מודלים כלכליים ותמחור.
•	ניסיון בניהול תחום תשתיות מחקר/ מעבדות/ מרכזי שירות למחקר באקדמיה או בגוף ציבורי/ממשלתי- יתרון.
•	היכרות עם עולם המימון למחקר ותשתיות מחקר בארץ ובעולם – יתרון.
•	ניסיון בניהול צוות עובדים - יתרון.
•	שליטה מלאה ביישומי Office.
•	שליטה בשפות עברית ואנגלית ברמה טובה מאוד, בכתב ובעל פה.
•	כושר ניהול, יוזמה, ראייה מערכתית, יכולת עבודה מול גורמים בכירים בארץ ובחו""ל, תודעת שירות גבוהה ויחסי אנוש מצוינים.
היקף:	משרה מלאה"
רכז/ת גיוס- משאבי אנוש,האוניברסיטה העברית בירושלים,ירושלים,2026-05-09,,https://huji.hunterhrms.com/job-details/?jobcode=JB-4963,JB-4963,קמפוס הר הצופים,,onsite,"ניהול תהליך גיוס מקצה לקצה לגיוס עובדים מנהליים במגוון רחב של תחומים ליחידות האוניברסיטה השונות:
•	איפיון משרות וניסוח תיאורי ודרישות תפקיד.
•	פרסום המשרות באתר האוניברסיטה, אתרי דרושים, רשתות חברתיות עם דגש על LinkedIn, כולל סורסינג.
•	הגדלת מקורות הגיוס כולל איתור קבוצות ב- Facebook וב- WhatsApp והצטרפות אליהן.
•	מיון קורות חיים, ביצוע ראיונות טלפוניים ופרונטליים וראיונות ממליצים.
•	תאום והכנת וועדות בחירה והשתתפות בהן.
•	העברת סימולציות שכר/ חוזים למועמדים שהתקבלו.
•	טיפול בסגירת משרות והוצאת מכתבי קבלה ודחייה.
•	מתן מידע למתעניינים על משרות פנויות באוניברסיטה.
•	עבודה שוטפת מול מנהלי יחידות ומנהלי כ""א באוניברסיטה.
•	השתתפות בפרויקטים כגון חבר מביא חבר, מיתוג מעסיק ועוד.
•	משימות נוספות בהתאם לדרישות הממונה.","•	תואר אקדמי. תואר בפסיכולוגיה/מדעי ההתנהגות- יתרון.
•	ניסיון בעבודה כרכז/ת גיוס ובביצוע ראיונות עומק.
•	ניסיון בגיוס ברשתות חברתיות וסורסינג.
•	ידיעת השפה העברית על בוריה ואנגלית ברמה טובה.
•	אדם של אנשים, בעל/ת יכולת אבחונית מעולה, יוזמה, יכולת עבודה בצוות, תודעת שירות גבוהה ודיסקרטיות.
•	כושר ביטוי מעולה בכתב ובעל פה, יכולת למידה מהירה ויכולת עבודה בריבוי משימות תוך עמידה בלוחות זמנים.
היקף: משרה מלאה"
